caption,image_path,label,best_guess_labels,web_description,page_title_matching_images
Photograph shows a family that was taken away by local epidemic prevention personnel after they had returned home from Hubei Province in February 2020 while they were asked to self-quarantine in their homes for 14 days.,images/false_0.jpg,out-of-context,police state china,", Beijing, Police state, Demonstration, Surveillance, Security, Shanghai Municipal Police, Zero-COVID, Pepper spray","China's Police State Targets Zero-Covid Protesters - WIRED, China Strengthens Police Presence in Response to Protests - VOA, Crowd angered by lockdowns calls for China's Xi to step down, China: Police deployed in force to prevent protests – DW – 11/29/2022, China Eases Some Anti-COVID Restrictions as Protests Mount - VOA, China Arrests BBC Journalist Covering COVID Protests - VOA, China Covid: Security apparatus swings into action to smother protests, China Moves to Curb and Censor Rare, Nationwide Protests - VOA, White House says 'everyone has the right to peacefully protest' after ..., Nationwide protests in China call for easing COVID curbs - DW, China protests: Dramatic photos from across the country - BBC, Protesters call for Xi to resign amid unprecedented unrest over ..., China's failing covid strategy leaves Xi Jinping with no good options, China's lockdown protests spread to campuses and cities abroad, a visual guide to three years of Covid in China - The Guardian"
Image shows electric scooters abandoned due to Mobike's downsizing its fleets to avoid an oversupply as the bike-sharing market falters.,images/false_1.jpg,out-of-context,electric scooter problems,"Electric kick scooter, Scooter, Kick scooter, Electric Bike, Electric Scooter, Motorized scooter, Electric vehicle, Electric motorcycles and scooters, Electricity, Bike, Motorcycle, Wrecking yard, Traffic code, Waste","What is the problem of electric scooter - Isin, Electric Scooter Problems And Solutions (Plus Best and Worst ..., The Environmental Impact of Electric Scooters: How Green Are They ..., Quanto sono Green i Monopattini Elettrici? - ElettricoSmart, Elektrická kolobežka a jej dopad na životné prostredie"
Image shows unnamed runway model showcasing designs from Chinese designer and performance artist Sheguang Hu's collection during the Mercedes-Benz China Fashion Week.,images/false_2.jpg,out-of-context,sheguang hu,"New York Fashion Week, Amsterdam Fashion Week, Fashion show, China Fashion Week, Haute couture, Fashion, New york fashion, Fashion week, Runway, Fashion design, Vogue, Clothing","Sheguang Hu Stunned A/W NYFW 2020 - Christian Mosi Lifestyle Blog, SILK ROAD·PENTIUM-SHEGUANG HU, china fashion collective - Christian Mosi Lifestyle Blog, 丝路·奔腾 - 武汉胡二爷文化传媒有限公司"
A sketchfab 3D rendering of the actor Andre the Giant.,images/false_3.jpg,out-of-context,wwe andre the giant png,"André the Giant, WWE, , Professional wrestling, Wrestler, André the Giant, WWE, WWE Hall of Fame, The Wrestling Classic, André the Giant Anıt Ödülü, WWE Championship","André the Giant png images | PNGWing, Andre The Giant | WWE 2Ks - Fandom, Andre the Giant - WWE, ""ANDRE THE GIANT” to Debut on HBO | Business Wire, André the Giant Professional Wrestler Professional wrestling WWE ..., Andre the Giant Wrestling Photos for sale | eBay, Andre the Giant Wrestling Posters for sale - eBay, Andre the Giant Bio Information - WWE - FOX Sports, Andre the Giant WWE Wrestling Photos for sale | eBay, André the Giant Professional Wrestler Professional wrestling WWE ..., André the Giant Memorial Battle Royal Professional Wrestler WWE ..., Larger than life photos of Andre the Giant - WWE, André the Giant Professional Wrestler Professional wrestling WWE ..., André the Giant Memorial Battle Royal Professional Wrestler WWE ..., Andre The Giant incredible Randy Savage"
Image shows abandoned white cars in China that belong to an electric car-sharing company that was named Microcity which went bankrupt in 2019.,images/false_4.jpg,out-of-context,parked white cars,"Car, Photo agency, Mercedes-Benz W201, Mercedes-Benz W126, Volkswagen Scirocco, Ford GT40, Volkswagen 1-litre car, Volkswagen Polo GTI, Ford Model T, Volkswagen, Image, Photography, Parking, Muscle car, ","Grid of parked white cars | Rich Iwasaki - Photographer, White cars parking hi-res stock photography and images - Alamy, Japan cars hi-res stock photography and images - Alamy, Parked cars in japan hi-res stock photography and images - Alamy, Company cars hi-res stock photography and images - Alamy, Autos autos hi-res stock photography and images - Page 13 - Alamy, Newspaper publishing hi-res stock photography and images - Page 2, Picture Association - QBN, Japan parked cars -Fotos und -Bildmaterial in hoher Auflösung, Japan parked cars Banque de photographies et d'images à ... - Alamy, Japan cars Photos Stock & Des Images - Alamy, Auto aziendali immagini e fotografie stock ad alta risoluzione - Alamy, Automobili del giappone Immagini Stock - Alamy"
"Image shows athletes resting in hammocks while participating in an extreme sport called highlining, which entails walking on a thin band of rope suspended at great height.",images/false_5.jpg,out-of-context,rock climbing sleeping,"Mountaineering, Rock climbing, Sleeping Bag, Sleep, Portaledge, Climbing, Mountain, El Capitan, Backpacking, Outdoor recreation, Pitch","How Rock Climbers Sleep on the Side of a Cliff, Sleeping Around With Dr. Chris Winter—Night on a Portaledge, Rock climbing top sleeping bag - spinreact.com.mx, Mountain climbers getting some sleep... : r/interestingasfuck - Reddit, Climbing sleeping hot sale bag, Sea to Summit is out NOW for free! After two years in major film ..., Rock climbing top sleeping bag - Vbcoop.com, Jacob Cook - Sea to Summit is out NOW for free! After two..., I left the valley eight days ago feeling beaten down and deeply ..., Sleeping Around with Dr. Chris Winter | Sleep.com, Starting climbing straight out of the Arctic Ocean is even ... - Instagram, I've been thinking a lot about scale of climbing objectives ... - Instagram, UKC Articles - Perfect Partners - UKClimbing, Mountain climbing hotsell sleeping bag, mountain climbing sleeping bag - manaliroutes.com"
Image shows grounds covered with garbage after the end of Glastonbury Music Festival in 2015.,images/false_6.jpg,out-of-context,dirty park,"Getty Images, , Photo agency, Image, Portrait, Photograph, Getty Images, Waste, Park, JPEG","10249 Dirty Park Stock Photos & High-Res Pictures - Getty Images, 10259 Dirty Park Stock Photos and High-res Pictures - Getty Images, 441 Dirty Tupperware Stock Photos, High-Res Pictures, and Images, 1076 Garbage Cans In Park Stock Photos & High-Res Pictures, 846 Dirty College Stock Photos, High-Res Pictures, and Images, 200 Empty Bottles After Party Stock Photos and High-res Pictures, 206 Empty Bottles After Party Stock Photos and High-res Pictures, 483 After Party Garbage Stock Photos, High-Res Pictures, and Images, 500 After Party Garbage Stock Photos, High-Res Pictures, and Images, 206 Empty Bottles After Party Stock Photos and High-res Pictures, 963 Madrid Trash Stock Photos, High-Res Pictures, and Images, Randall Beach: Is it 'socialist' to ban plastic bags?, 614 Parque Ciudad Stock Photos and High-res Pictures - Getty Images, 1105 Madrid Trash Stock Photos, High-Res Pictures, and Images, 206 Empty Bottles After Party Stock Photos and High-res Pictures"
"A photograph captured by NASA’s Mars Curiosity Rover on May 7, 2022, showed a rock crevice on the red planet.",images/false_7.jpg,out-of-context,surface of the moon,"Earth, Moon, Moon, Lunar water, Impact crater, Far side of the Moon, Circumlunar trajectory, Photograph, Apollo 8, rounded, Science, Stockbyte, Photography","What's on the surface of the moon? - Science | HowStuffWorks, Moon Surface Photos for Sale, Close-up Of The Surface Of The Moon by Stockbyte, Close-up Of The Surface Of The Moon Jigsaw Puzzle by Stockbyte, Structure and mineralogy of the Moon's craters up close - Nature, How soon will we be able to create a moon base? | HowStuffWorks, What's more important, water on the moon or on Mars?, Close-up Of The Surface Of The Moon by Stockbyte - Pixels, Close-up Of The Surface Of The Moon Photograph by Stockbyte, What if we lived on the moon? - Science | HowStuffWorks, Close-up Of The Surface Of The Moon Poster by Stockbyte, Close-up Of The Surface Of The Moon Art Print by Stockbyte, What Is a Round Pit on the Moon's Surface? - Education - Seattle PI, 3117 Grey Moon Stock Photos & High-Res Pictures - Getty Images, Moon surface close gelreat up"
"A photograph shows a sign that reads 'whites only within city limits after dark', taken from 2018 movie Green Book.",images/false_8.jpg,out-of-context,Racial segregation,"Civil rights movement, Jim Crow, Racial segregation, White people, Jim Crow laws, Racial segregation in the United States, Discrimination, Racial discrimination, Apartheid, Colored, Anti-racism, Passing","Racial segregation in the Southern states - Civil rights in the USA, Racial segregation in the Southern states - Civil rights in the USA, Racial segregation in the Southern states - BBC, Post-1945 segregation - Civil rights in the USA: Video playlist - BBC, New IAM Video Celebrates Civil Rights and Healthcare - IAMAW, Racial segregation Black and White Stock Photos & Images - Alamy, Racial segregation signs Black & White Stock Photos - Alamy, Same-sex marriages and segregation - The Cripplegate, Segregation signs hi-res stock photography and images - Alamy, Racial Segregation - Pinterest, Segregation whites only hi-res stock photography and images - Alamy, Can Architecture Be Used to Enforce Racism? Part 1. Proposition, Racism And Discrimination Are Significant Contributing Factors To ..., Deregulation Is an Anti-Racist Policy | The Daily Economy, That Would Put Us at 1888 - The Gospel Coalition"
"Image of a bus powered by compressed natural gas, bursting into flames in Italy.",images/false_9.jpg,out-of-context,bluestar bus fire,"Bus, Double-decker bus, Fire, Passenger, Portsmouth, M27, , Bluestar, Flame, Explosion, Transport, Smoke, Conflagration, Fire department","M27 bus fire: Video footage compilation shows double-decker ..., Hampshire motorway closed by double-decker bus fire - BBC News, Fire engulfs double-decker bus on M27 motorway - Evening Standard, M27 CLOSED AS BUS BURST INTO... - Hampshire And Iow News, Fire crews tackle blaze at Portsmouth high-rise flats - BBC News, Paraglider films lorry fire on M1 in Leicestershire - BBC News, Dorset and Hampshire Live: Friday 26 August - BBC News, Highways England - latest news, breaking stories and comment, Three fire dragons spew out! The Italian gas bus exploded and ..., Greater Noida: यूपी रोडवेज की बस में लगी आग, यात्रियों ने बस से कूदकर ..., Pune: PMPML bus goes up in flames, 17th bus to catch fire in two, مصرع 25 شخصا باندلاع حريق داخل حافلة في الهند - دنيا الوطن"
A Norwegian naval ship is being struck by a missile that was fired by the Norwegian Navy in 2013,images/false_10.jpg,out-of-context,prestige oil spill,"Prestige oil spill, , Environmental disaster, Oil spill, Oil tanker, Ship, Shipwreck, Aframax, Petroleum, Tanker, Ore-bulk-oil carrier, MV Prestige, 2002, Oil","Learn from the past: Prestige sinking, one of the worst oil spills in ..., “Many of us lined our pockets with the Prestige oil spill” | Spain, Prestige oil tanker spill: three go on trial in Spain - The Guardian, Spain: Prestige oil spill disaster trial begins - YouTube, Row over Prestige Oil Spill Continues – DW – 11/19/2003, ""Prestige"" insurer must pay Spanish claim over oil spill, EU Court ..., Insurer Must Pay Spanish Claim in Prestige Oil Spill, EU Court Says, 515 Prestige Oil Spill Stock Photos, High-Res Pictures, and Images, Walk of Memory: the disaster of Prestige - O Camiño dos Faros, Court upholds $1.8 billion compensation from Prestige oil spill, Thousands join Prestige protest | Oil spills | The Guardian, Insurer Ordered to Pay $1 Billion Over 2002 Prestige Oil Spill, Court orders 1.6bn euros compensation for Spain over Prestige oil ..., The Prestige oil tanker disaster | Environment | The Guardian, Spain to Appeal Prestige Oil Spill Ruling - gCaptain"
Image shows an art installation of a giant snake by the Chinese artist Huang Yong Ping is exhibited on a beach in France.,images/false_11.jpg,out-of-context,titanoboa skeleton,"Titanoboa cerrejonens, Vertebrate, Boas, Snake skeleton, Skeleton, Dinosaur","42ft Titanoboa skeleton replica : r/Naturewasmetal - Reddit, Is This a Titanoboa Monster Snake Skeleton? | Snopes.com, Titanoboa - Dinosaurs Battle World Championship Wiki - Fandom, Titanoboa | The Age of Trilogy Wiki - Fandom, Huang Yong Ping 'Ressort': A gigantic snake skeleton, Titanoboa - Dinosaurs Battle World Championship Wiki - Fandom, Kentrosaurus - Dinosaurs Battle World Championship Wiki - Fandom, If I went back to the Cretacious era to go fishing, what would I catch ..., Bean Life Science Museum at BYU - Facebook, Bean Life Science Museum at BYU - Facebook, Watch as we install Kwoma Arts, Koromb (spirit house) - YouTube, October 2017 - Bean Blog, Titanoboa: Monster Snake - Bean Blog, 2017 - Bean Blog, Watch as we install Kohei Nawa's 'PixCell-Double Deer #4 for 'Iris ..."
Image shows historical plane being towed behind a tractor while celebrating the 20th anniversary of the formation of the Croatian Armed Forces in 2011.,images/false_12.jpg,out-of-context,fighter jet trailer,"McDonnell Douglas F-15 Eagle, Mitsubishi F-2, McDonnell Douglas F-15E Strike Eagle, Shenyang J-11, Eurofighter Typhoon, Jet aircraft, Tyndall Air Force Base, Northrop T-38 Talon, Sukhoi Su-30MKK, Sukhoi Su-27, Fighter-bomber, Truck","Moving a F-15C Fighter Jet with Semi-trailer Truck - YouTube, F-15 Fighter Jet Transported Thru Panama City By Big Rig - YouTube, Never, please, never tell us again that our army does not meet ..., Russia has begun a full-scale invasion in Ukraine [READ STAFF ..., Moving a F-15C Fighter Jet with Semi-trailer Truck - 香港討論區, Jets - YouTube, Tegljači (Vučni vozovi) - MyCity Military, Dünya'dan Güncel ve Nostaljik Ulaşım Fotoğrafları - 29. Sayfa"
A image taken from the movie 'The Search' shows Russian soldiers before they start killing Chechnyans at the start of the Second Chechnyan War.,images/false_13.jpg,out-of-context,aleksei kravchenko,"Aleksei Kravchenko, Elem Klimov, Come and See, Olga Mironova, The Ascent, War, , World War II, frightening, Drama, IMDb, Film director","A Russian Filmmaker's Travelogue of Hell - The New York Times, This World War II Movie's Harsh Production Reflects Its Horrific True ..., Come and See (1985) It's been said that Aleksey Kravchenko was ..., Aleksey Kravchenko - IMDb, Aleksey Kravchenko - IMDb, Aleksey Kravchenko - IMDb, Review: Why you must see 'Come and See' on the big screen, This WWII Movie Gave Us the Most Sickening 25-Minute Sequence ..., COME AND SEE / THE ASCENT - American Cinematheque, Why Putin should pay more attention to Russian cinema history, There's No Other War Movie as Horrifying, or Vital, as Come and See, Seven war films acclaimed for their realism | by Tom Davidson, Come and See - Janus Films, Come and See the scariest & the most horrendous movie ever, 'Horrific' drama that used real bullets during filming is being called ..."
"Image shows a 'Die in' climate protest in Austria, where protesters got inside of body bags to signify the catastrophic impact that current climate policy could have on the world.",images/false_14.jpg,out-of-context,halloween decorations hanging from tree,"Tree, Interior design, JOYIN Halloween Tree Wrap Ghost Decoration, Ornament, Halloween Ornament, Garden, outdoor","Halloween decorations taken down after being dubbed ""racially ..., Halloween decorations taken down after being dubbed ""racially ..., Halloween decorations taken down after being dubbed ""racially ..., 10 Halloween door decorations ideas - Pinterest, Halloween Body Bag Diy - Pinterest, Halloween decorations taken down after being dubbed ""racially ..., 16 Times People Overdid Halloween Decorations And Got The ..., Halloween decorations taken down after being dubbed ""racially ..., 16 Times People Overdid Halloween Decorations And Got The ..., Halloween decorations taken down after being dubbed ""racially ..., Halloween decorations taken down after being dubbed ""racially ..., Halloween decorations taken down after being dubbed ""racially ..., discounts on sale hanging after tree Montreal halloween intervene ..., Halloween decorations taken down after being dubbed ""racially ..., Halloween decorations taken down after being dubbed ""racially ..."
Image of a 12 year old Palestinian activist girl confronting an Israeli soldier in November 2012.,images/false_15.jpg,out-of-context,people protesting,"Photograph, Occupy Wall Street, Occupy movement, Image, Roe v. Wade, Chile","'It felt like history itself' – 48 protest photographs that changed the ..., International Women's Day 2024: 12 iconic images of defiant women, 'We'll be hated, but it will stir things up': Insulate Britain on what ..., Dakota Access pipeline | The Guardian, Pictures of the decade: Part two | The Wider Image | Reuters, Best photographs of the day: Eid al-Adha and a protest in Chile | News, Chile demonstrator's defiant stare goes viral - CNN, Don't blink first! The power of a stare - BBC, She's A Crowd on Instagram: ""Day 1: “the hardest pic of all time ..., 2016: The Year in Photos, September-December - The Atlantic, Pull me closer if you think you can hang * * Slide 1 - From a protest ..., People Are Sharing This Photo Of A Young Woman Standing Up To ..., Adbusters Archive, Adbusters Archive, Adbusters Archive"
Picture of China launching a space rocket in December 2019.,images/false_16.jpg,out-of-context,rocket ship,"Rocket, Space Shuttle program, Spaceplane, Space exploration, Space Shuttle, Launch vehicle, Rocket engine, Spaceflight, Space Shuttle orbiter, Satellite, Space Shuttle Discovery, NASA, , Orbital spaceflight, RS-25","20,000+ Free Rocket Ship & Rocket Images - Pixabay, Space Shuttle - Wikipedia, Virgin's Orbit's Failed Rocket Launch & The History Of Air Lauched ..., A Brief History of Space Exploration | The Aerospace Corporation, History of rockets - Wikipedia, Inside A Rocket Ship: Discover Giant Sea Creatures - TikTok, 36300 Free images of Rocket Ship Aliens - Pixabay, 2230 Free images of Rocket Launch - Pixabay, 29112 Free images of Rocket Ships - Pixabay, Four Old Space Shuttle Engines Team Up For One Last ... - YouTube, Sea Launch And Its Amazing Ocean Going Rocket Launch Site, Spaceplane - Wikipedia, Rockets Pictures - Walmart, 3. History of Rockets & Space Flight - Eagle Pubs, Laminated 24x37 Poster: Rocket Launch Rocket Take Off NASA ..."
Photograph shows a person hanging from a helicopter with a harness while waving to the people on the ground.,images/false_17.jpg,out-of-context,helicopter rotor,"Helicopter, Soldier, Armed forces, Sikorsky S-70, India, Military helicopter, Mil Mi-8, Indian Army, Car","Exercise Thar Shakti concludes - SP's MAI, Experience in Commando School, Belgaum - YouTube, रेगिस्तान की भीषण गर्मी में इंडियन आर्मी ने दिखाई अपनी 'थार शक्ति', सेना और आतंकवादियों के बीच मुठभेड़, एक अधिकारी समेत चार जवान बलिदान ..."
Image shows U.S. Senator Rand Paul receiving a booster vaccination for Hepatitis A in 2015.,images/false_18.jpg,out-of-context,Bernie Sanders,"Brian P. Monahan, Bernie Sanders mittens meme, United States Senator, Vermont, COVID-19, Bernie Bro, COVID-19 vaccine, Vermont Business Magazine, Coronavirus, ","Senator Bernie Sanders Receives COVID-19 Vaccine from U.S. ..., Senator Bernie Sanders Receives COVID-19 Vaccine from U.S. ..., Senator Bernie Sanders receives COVID-19 vaccine, Bernie Sanders gets COVID-19 vaccine | Vermont Business Magazine, Oh my fucking god, they're putting down Bernie Sanders - X, Four COVID-19 deaths reported in Vermont over weekend, Bernie Sanders Receiving COVID-19 Vaccine | Know Your Meme, All Entries - Know Your Meme, Liam Johnston (@liam_johnston26) / X, Not 16, Not 20, But 24 Dank Bernie Sanders Memes, Bernie Sanders: Image Gallery - Know Your Meme, Amanda Mitchell (@mandapanda56) / X, Bekah Thomas (@bekah_thomas16) / X, Luisa Suarez (@xluisaaaxo) / X, Colette Dowling (@colette_dowling) / X"
Image shows plastic bags of gasoline in the trunk of a car after two men attempted to steal gasoline from a gas station in Mexico in 2019.,images/false_20.jpg,out-of-context,hatchback,Hatchback,
"Photograph of U.S. presidential candidate Joe Biden kneeling to speak with a young boy in Detroit, Michigan, in September 2020.",images/false_22.jpg,out-of-context,Joe Biden,"United States, Vice President, Presidential nominee, , Running mate, Candidate, President-Elect","Joe Biden shares picture of himself kneeling with ... - FOX 5 Atlanta, can Biden overcome the racist legacy of the crime bill he backed ..., 'Healthy, vigorous' Joe Biden physically fit to serve as president ..., Joe Biden says he is the 'most qualified person' to be president, Joe Biden: I regret not running for president - The Guardian, Joe Biden shares picture of himself kneeling with ... - FOX 7 Austin, Joe Biden Visits George Floyd Protest Site - People.com, How Joe Biden's VP contenders stack up in the wake of George ..., Joe Biden shares picture of himself kneeling with ... - FOX 2 Detroit, ""Nation In Pain"": Joe Biden Visits Scene Of US Anti-Racism Protest, Joe Biden shares picture of himself kneeling with ... - FOX 5 New York, Black women mount public and private campaign for Biden to ... - CNN, Joe Biden Clinches Democratic Nomination for 2020 Election, The Joe We Know - Out & About Magazine, Joe Biden shares picture of himself kneeling with ... - FOX 35 Orlando"
"Photograph of Prince Philip wearing the ceremonial dress, preparing to escort Queen Elizabeth to the ceremony of the Grenadier Guards.",images/false_23.jpg,out-of-context,queen elizabeth prince philip age,"Prince Philip, Elizabeth II, British royal family, Death and funeral of Prince Philip, Duke of Edinburgh, Buckingham Palace, Queen regnant, Monarch, Prince, Monarchy of the United Kingdom, Army officer, Lord High Admiral of the United Kingdom, , Death","Britain's Prince Philip dies at age 99 - ABC News, Photos show how Queen Elizabeth and Prince Philip's relationship ..., Britain's Prince Philip dies at age 99 - Good Morning America, ""Deeply Touched"" By Support After Prince Philip Death - NDTV, Prince Philip, Husband of Queen Elizabeth II, Dies at 99, OBITUARY Prince Philip was the gruff figure at heart of Britain's ..., Queen Elizabeth Says 'Familiar Laugh Missing' as She Honors ..., Queen Elizabeth To Bury Her ""Strength And Stay"" Prince Philip Today, Prince Philip, the Husband of Queen Elizabeth II, Has Died At 99, Prince Philip's Life in Photos - NBC4 Washington, Sweetest Things Queen Elizabeth Said About Prince Philip, The Queen's 73-year marriage to Prince Philip, who she first met at 13, What We Know About Prince Philip's Funeral: Burial Plans, COVID ..., Prince Philip's scaled-back funeral marks shifting times for UK's royals, Prince Philip, Duke of Edinburgh - Financial Times"
"Photograph of U.S. Senator Lindsey Graham with far-right politician Geert Wilders at the Ambrosetti Forum, an annual international economic conference in Italy September 2019.",images/false_24.jpg,out-of-context,lindsey graham elton john,"Darline Graham Nordone, Elton John, John McCain, David Furnish, Politics, Alexandra Jaffe, Larry Nordone, ","Graham opens up about lost loves in new e-book | CNN Politics, Lindsey Graham Fast Facts | CNN Politics, Lindsey Graham retires from Air Force | CNN Politics, Mark Kirk: Lindsey Graham is a 'bro with no ho' | CNN Politics, Lindsey Graham takes on Clinton, Trump over immigration - CNN, Lindsey Graham's political career - CNN, Lindsey Graham: June 1 presidential announcement | CNN Politics, Lindsey Graham on Donald Trump: Immigration plan 'gibberish' - CNN, Lindsey Graham's presidential campaign of doom and gloom - CNN, Graham's GOP tent is big enough for Caitlyn Jenner | CNN Politics, Graham talks Iran, ISIS in foreign policy speech | CNN Politics, Lindsey Graham presidential bid bets on foreign policy | CNN Politics, Will Lindsey Graham's hawkishness fly? - CNN, Graham campaigns on NSA in first New Hampshire trip | CNN Politics, Will Americans vote for a bachelor president in 2016? | CNN Politics"
"Photograph shows a boat being frozen in Geneva, Switzerland, in 2005",images/false_25.jpg,out-of-context,snow,"Ship, Image, Travel Nunavut, Northern Canada, Boat, Photograph, , Snow, Fishing vessel, Iqaluit, Photo agency, snow storm","Ryersonclark Pictures, Images and Stock Photos - iStock, 110+ Baffin Island Nunavut Canada In Winter Stock Photos, Pictures ..., 250+ Iqualit Photos Stock Photos, Pictures & Royalty-Free Images, Frobisher Bay Photos Pictures, Images and Stock Photos - iStock, Canadian Health Labs - Facebook, Iqaluit Nunavut Fishing Welcome to Nunavik! Quebec's Far North"
