caption,image_path,label,best_guess_labels,web_description,page_title_matching_images
A photograph by UNICEF of a little girl in front of a herd of sheep in Morocco on 15 June 2005.,images/false_151.jpg,out-of-context,woman tending sheep,"Sheep, Goat, sheepman, Herd, Herding, , Livestock, Herder, Goatherd, Image, available, Printing","Woman Herding Sheep Sheep best Stock, Shepherds Girls... - Pinterest, 15 Shepherds and sheep ideas - Pinterest, Shepherds Girls... - Pinterest, Beautiful Girl fabulous Image Peasant, An Iraqi Shepherd, a Young Girl, Herds Her Sheep - Art.com, An Iraqi Shepherd, a Young Girl, Herds Her Sheep - AllPosters.com, Shepherd herding, Middle Eastern People (Photography) Photographic Prints, Middle Eastern People (Photography) Posters & Wall Art Prints, Middle Eastern Figurative Posters & Wall Art Prints | AllPosters.com, Middle Eastern People Photography Wall Art, Middle Eastern Culture by Subject Photography - Art.com, Middle Eastern People Wall Art: Prints, Paintings & Posters, Shepherds Girls... - Debbi's Blog"
Photograph show a car whose parts melted from the intense heat caused by nearby fire at a construction site in Arizona.,images/false_152.jpg,out-of-context,car melting heat,"Car, Renault Group, Renault Scénic, Compact sport utility vehicle, Compact car, SUV, , Station Wagon, Truck, Driving, Heat, Mini MPV, Tire, Bumper","A Car in Australia Whose Aluminum Rims Have Melted - Reddit, Car melts because of the heat in Caorle, Italy : r/mildlyinteresting, VIDEO: British tourist films car MELTING in killer heatwave in Italy | UK, A car MELTS in the sun during a heatwave of 100F in Italy - Daily Mail, Melting/Warping Side Mirror | Subaru Ascent Forum, Renualt melts in heat | RMS Motoring Forum, It's so hot in Italy that cars are melting - Metro, British tourist captures moment car melts in street as killer heatwave ..., Italian Heatwave Literally Melts Car - Motors Mega, Italian Heatwave Literally Melts Car - Motors Mega, Italian Heatwave Literally Melts Car - Motors Mega, The best Car Melted memes - Memedroid, incredible moment - Mème par ahadsy5 - Memedroid, Restoring black plastic trim - R Detailing - VWROC, Pictures of the day: 11 August 2015 - Pinterest"
"A photograph shows Cuban Elian Gonzalez refugee in a bedroom closet with Donato Dalrymple, one of the two men who rescued the boy from the sea, as federal agents enter the Little Havana home of Elian's relatives in 2000.",images/false_154.jpg,out-of-context,soldier,"Yasser Arafat, Soldier, Israel, , Infantry, , Palestinians, House arrest, Handcuffs, Older kid","Soldiers arrest two Palestinian children (11) for about 15 hours and ..., Israeli soldiers arrest 2 Palestinian children for 15 hours, hold them ..., جنود يعتقلون طفلين في الـ11 طوال نحو 15 ساعة خلال معظمها كانوا ..., חיילים עצרו שני ילדים בני 11 למשך כ-15 שעות שבמהלך רובן הוחזקו בבסיס ..."
"A photograph depicts a small boy being held in a cage during a protest staged in front of Dallas City Hall to call attention to the Trump administration's practice of separating families and confining undocumented children, taken on 10 June 2018.",images/false_155.jpg,out-of-context,toddler cage,"Cage, Infant, Parent, Alapaha blue blood bulldog","Chinese police investigate after toddler seen crying in a cage in video, Chinese police investigate parents after toddler seen crying in a ..., Father locked 20-month old daughter in a CAGE and ... - Daily Mail, 'Dad stop beating me,' pleads toddler in viral video in China, how to apply for government jobs after 12th It Industry Jobs, salesforce developer jobs in dubai Yellow Work Saree, contract based govt jobs tekla modeler jobs in chennai, v mart job in jaunpur : Unlock Discounts While Earning Online, uttarakhand job card mall job resume: Stand Out in India's ..., tgt maths jobs in delhi : Save Time and Earn More with Online Work, ถ่ายทอดสดฟุตบอลซูซูกิคัพ 2021 คลิปบอลเมื่อคืน วอลเปเปอร์ คอม ฟรี, ตรวจลอตเตอรี่ 1 พย 65 ตรวจ หวย 16 5 2556 ข่าว อา ซาร์ ล่าสุด, Un père de famille enferme sa petite fille dans une cage pour chien ..., ngược đãi - VietNamNet, Ama, inabuso ang anak sa pamamagitan ng pagkulong sa hawla"
"A photograph shows a mother cheetah attempting to teach her cubs how to kill prey, then eventually dispatching a captured impala when her inexperienced cubs proved they weren't yet up to the task of strangling it themselves.",images/false_156.jpg,out-of-context,lion,"Lion, Hyenas, Spotted hyena, Zebra, Wolf, American bison, Gazelle, Lion hunting, Herd","Lion cub is shown how to hunt by lioness after it wounds the prey, Lion cub is shown how to hunt by lioness after it wounds the prey, تجربه اولین شکار بچه شیرها با کره گورخر و بوفالو - برترین ها, (ویدئو) تجربه اولین شکار بچه شیر‌ها با کره گورخر و بوفالوی نگون بخت, (ویدئو) تجربه اولین شکار بچه شیرها با کره گورخر و بوفالوی نگون بخت, تجربه - برترین ها, کره | صفحه 5 - برترین ها, کُره | صفحه 5 - برترین ها, گورخر | صفحه 2 - برترین ها, Begini cara singa ajari anaknya berburu mangsa - Merdeka.com, شیر | صفحه 71 - برترین ها, بوفالو | صفحه 7 - فرادید, گورخر | صفحه 4 - فرادید, Begini cara singa ajari anaknya berburu mangsa - Merdeka.com, فیلم| تجربه اولین شکار بچه شیر‌ها با کره گورخر و بوفالوی نگون بخت"
"A photograph captures a massive multi-day traffic jam in China, from the infamous August 2010 China National Highway 110 traffic tie-up.",images/false_157.jpg,out-of-context,delhi traffic jam,"Traffic congestion, Traffic, New Delhi, Car, Traffic police, Delhi Gurugram Border - NH 48, back, Road, Highway","Bharat Bandh: Delhi-Gurugram Border Witnesses 1.5 Km Traffic Jam, India's decarbonization and its wider economic goals - Aspenia Online, Bharat Bandh: Parts of Delhi witness traffic jams as farmers go on ..., Delhi Hulchal (दिल्ली हलचल): delhi traffic jam photo, Delhi Hulchal (दिल्ली हलचल): heavy traffic in delhi ncr, Amid Farmers' Bharat Bandh, Traffic Snarl Chokes Delhi-Gurugram ..., Latest Articles, Videos and Photos of Delhi Police - Telegraph India, Latest Articles, Videos and Photos of Traffic - Telegraph India, Latest Articles, Videos and Photos of Police - Telegraph India, Latest Articles, Videos and Photos of Farm Laws - Telegraph India, Traffic Jam Bharat Bandh Parts Of Delhi Witness Traffic Jams As, The impact of Cars on city's Transportation system - RTF, Why do we all love the colour 'white' so much? : r/CarsIndia - Reddit, CHIRANJEEVI GOPAL - Application Specialist - Accenture - LinkedIn, Vince Farahjian - Managing Partner - One Entertainment Group"
"A photograph shows a swimming instructor and a woman at Midland Beach in Staten Island, New York in 1898.",images/false_158.jpg,out-of-context,sitting,"1950s, Swimsuit, 1920s, 20th century, 1900s, 1940s, Beach, Fashion, ","Couple on the beach at Margate - Pinterest, Couple on the beach at Margate - Pinterest, aaa (aaa1609) - Profile - Pinterest, loupus Pango (maehepango) - Profile - Pinterest, Vintage couples in love gallery (Mostly 1940s and 1950s) - Reddit, Vintage antigarden Lovely Aged Pair, 30 Vintage Photos of Men's Striped Swimwear from the Early 20th ..., The Favorite Swimwear of Men in the Early 20th Century, 42 idées de Les pieds dans l'eau - Pinterest, aaa (aaa1609) - Profile - Pinterest, aaa (aaa1609) - Profile - Pinterest, Galería de parejas enamoradas antiguas (principalmente de los ..., Galeria de casais vintage apaixonados (Principalmente dos anos ..., Galerie de couples amoureux vintage (principalement années 1940 ..., Galleria di coppie vintage innamorate (principalmente anni '40 e '50)"
Image decpits members of the Air Force Officers’ Spouses’ Club taken at the annual Joint Armed Forces of Washington Luncheon (JAFOWL) on April 24.,images/false_159.jpg,out-of-context,tourism,"Social group, Tourism",
Ukrainian strongman Dmytro Vasilievich Khaladzhi - a power-lifting champion - carrying a horse.,images/false_160.jpg,out-of-context,john wayne john ford alamo,"John Wayne, The Alamo, Western, future, Artist, Image, Photojournalist, SoundCloud, ","Magnum On Set: The Alamo, John Wayne followed by a set worker with a prop horse while filming ..., John Wayne on the set of the film, ""The Alamo"", Dennis Stock | Mia, John Wayne followed by his horse while filming THE ALAMO, circa ..., John Wayne and his horse on the set of The Alamo, 1960 - Reddit, wayn | Mia - Minneapolis Institute of Art, film | Mia - Minneapolis Institute of Art, Dennis Stock - ERIC KIM, The American Desert: an Elegy to Friendship • Raymond Depardon, Dennis Stock: Altered States - Howard Greenberg Gallery, Retronaut HQ (@retronauthq) / X, Magnum On Set: The Crucible – Inge Morath, Magnum on Set: The Unforgiven, Fake Horse - golden disko ship - SoundCloud, Nathalie Ortega - Artiste illustratrice - LinkedIn"
"A photograph shows an art installation of a dead whale choked by plastics, created by Greenpeace to 'underscore the massive problem of plastics pollution in the ocean' in Philippines in May 2017.",images/false_162.jpg,out-of-context,whale made out of recycled materials,"Plastic, Recycling, Whale, Plastic bag, create, Plastic pollution, Plastic bottle, Whale shark, Plastic recycling, Bottle","Plastic whale ocean hi-res stock photography and images - Alamy, A 10-metre long whale in Cardiff Bay, Wales, which is made entirely ..., Plastic whale hi-res stock photography and images - Alamy, Recovered from ocean hi-res stock photography and images - Alamy, Why is a giant whale made from plastic bags and bottles coming to ..., Plastic Free Waterford on X: ""So this whale is made up of 250kg of ..., milly bowen (@milly_bowen) / X, The Brummie with 19 children who invented plastic to SAVE the world, Customer-focused Whale With Plastic Bags, ලෝක වාර්තාවක් බවට පත්වන ප්ලාස්ටික් තල්මසෙක් ..., Plastic whale -Fotos und -Bildmaterial in hoher Auflösung - Alamy, Plastic whale Photos Stock & Des Images - Alamy, Plastic made immagini e fotografie stock ad alta risoluzione - Alamy, Balena di plastica immagini e fotografie stock ad alta risoluzione, Langer strandwal -Fotos und -Bildmaterial in hoher Auflösung - Alamy"
A photograph shows an 18-year-old Angela Merkel with her friends at a New Year's Eve party in Berlin in 1972.,images/false_164.jpg,out-of-context,vintage clothing,"Lady M, Vintage clothing, Retro style, Clothing, Lady M",
A photograph shows Tariq Ali and Vanessa Redgrave headlining a protest against the Vietnam War on 17 March 1968.,images/false_165.jpg,out-of-context,tariq ali 70s,"Tariq Ali, Ernest Mandel, Perry Anderson, 1960s, London Review of Books, United Kingdom, Pakistan, New Left","Tariq Ali · That was the year that was - London Review of Books, Tariq Ali spied on by at least 14 undercover officers, inquiry hears, From the archive, 4 September 1968: Tariq Ali explains the writing ..., Tariq Ali: 'Democracy is largely a set of rituals now', Tariq Ali on 1968 and Today - Portside.org, books Tariq Ali on 1968 and Today - Portside.org, How to spot the undercover cops | Letters - The Guardian, 20 Celebrities You Didn't Know Were From Warrenton, Oregon, Prague Spring: When Czechoslovakia Tried To Reform Soviet ..."
A photograph from the Spanish Civil War where Ernest Hemingway can be seen in the background.,images/false_166.jpg,out-of-context,spanish civil war,"Francisco Franco, Spanish Civil War, Spanish Revolution of 1936, Archivo General de la Guerra Civil Española, , Civil war, Spanish Language, , 1936, Anarchism, , Confederación Nacional del Trabajo, Workers' Party of Marxist Unification","Lost photos from Spanish civil war reveal daily life behind anti ..., Guy Lane | The Guardian, Fighting Fascism Spanish Civil War French and Italian partisans and ..., Photography + Photography | Page 157 of 1196 | Artanddesign, 'Dissolution of the Antifascist Militia Committees' from The Spanish ..., Mozart Times - Gymozart, Monday 13 June 2022 - The Guardian, Rigid in Communications, Part for Info Technical, Las cajas de Ámsterdam: Kati Horna y Margaret Michaelis en la ..., Una mirada extranjera, anarquista y femenina a la Guerra Civil en ..., Una mirada extranjera, anarquista y femenina a la Guerra Civil ..., Kati Horna y Margaret Michaelis: la guerra recuperada"
President Trump follows Japan's Prime Minister Shinzo Abe in dumping fish food into the koi pond.,images/false_167.jpg,out-of-context,nguyễn thị kim ngân cho cá ăn,"Nguyen Thi Kim Ngan, Presidential Palace, Barack Obama’s visit to Vietnam, National Assembly of Vietnam, Chairman of the National Assembly of Vietnam, Fish, US President, Fish market, President of Vietnam, , Chairperson","Obama in Vietnam - Reuters, Obama feeds fish in Vietnam - YouTube, WATCH: Obama feeds fish in Vietnam - Times of Oman, Viral - Times of Oman, WATCH: Obama feeds fish in Vietnam - Times of Oman, WATCH: Obama feeds fish in Vietnam - Times of Oman, T TV - Times of Oman, Obama cho cá ăn ở khu nhà sàn Hồ Chủ tịch - Báo VnExpress, Tổng thống Obama và Chủ tịch Quốc hội cho cá ăn tại Ao cá Bác Hồ, Điểm tên những nơi Tổng thống Obama ghé thăm tại Hà Nội, Video: Tổng thống Obama cho cá ăn tại ao cá Bác Hồ, Obama đến Việt Nam: những hình ảnh đặc sắc (phần 2), Trung tâm Hội nghị Quốc gia thắt chặt an ninh tối đa chờ Obama, Toàn cảnh 3 ngày Tổng thống Obama thăm Việt Nam, Tổng thống Mỹ Obama thăm Việt Nam - Báo VnExpress"
"A photograph shows a school lunch that was served to a student in Chickasha, Oklahoma, in 2014, consisting of some slices of ham and cheese, crackers, and cauliflower.",images/false_168.jpg,out-of-context,school lunch,"American cuisine, British Cuisine, Parishville-Hopkinton Central School District, Lunch, School meal, Meal, School, School district, Breakfast, Chicken, Fish fry, Kids' meal, Junk food, Cooking","What was the typical lunch on a public school in the US? - Reddit, Expert: How Parents Can Make a Difference in School Nutrition, Photo of Parishville-Hopkinton school lunch goes viral, parents ..., High school lunch photo shared by NY dad has parents concerned, Photo of Parishville-Hopkinton school lunch goes viral, parents ..., Upstate NY school lunch: four small chicken nuggets, a few ... - Reddit, Father's post with photos of his son's 'ridiculous' school meals goes ..., Parishville-Hopkinton answers questions as school lunch photos ..., NY school lunch photo sparks concern from parents - PIX11, PIX11 - WOULD YOU EAT THAT? An upstate New York school ..., What's wrong with school lunch : r/shittyfoodporn - Reddit, PIX11 - WOULD YOU EAT THAT? An upstate New York school ..., Average school lunch : r/shittyfoodporn - Reddit, PIX11 - WOULD YOU EAT THAT? An upstate New York school ..., PIX11 - WOULD YOU EAT THAT? An upstate New York school ..."
Image of President Barack Obama and his family serving meals to homeless U.S. military veterans during an event at St. Luke's Methodist Church in Washington D.C. on 25 November 2015.,images/false_169.jpg,out-of-context,chef,"Sasha Obama, Washington, Photography, Getty Images, , Photograph, Image, , DC Central Kitchen, Getty Images, Photo agency, stock.xchng, Emaze","Obama brags about his Asian cooking skills - Geo.tv, 223 President Obama Participates In Service Project Photos & High ..., 223 President Obama Participates In Service Project Stock Photos ..., 7,109 Sasha Obama Photos & High Res Pictures - Getty Images, Erikson Stages of Development by d.alexis007 on emaze, President Honors Martin Luther King, Jr With Day of Service, 223 President Obama Participates In Service Project Photos & High ..., Lovely Facts About Michelle Obama - Factinate, ورق بزنید ❤️ . @the.facts قدیمی‌ترین پیج دانستنی ‌ دانستنی‌های ..., 4.667 fotos e imágenes de alta resolución de Michelle And Sasha ..., Michelle Obama au D.C Central Kitchen de Washington lors du ..., Sasha Obama au D.C Central Kitchen de Washington lors du Martin ..., Photo : Europe 1 est allé jusqu'aux colonnes du Washington Post ..., 7.109 fotos e imágenes de alta resolución de Sasha Obama, Thomas Sotto lors de la conférence de presse de rentrée d'Europe 1 ..."
"A photograph of a scarecrow that lookss like a human corpse, a Halloween prop that appeared in May 2012 on the website The House of Marrow.",images/false_170.jpg,out-of-context,scp 872,"SCP Foundation, Wiki, Scarecrow, Meme, tall, Statue, Image","SCP-872 | The Tattered Farmer - SCP | Secure. Contain. Protect., SCP-872 - SCP Foundation - Pinterest, SCP-872 | Wiki | SCP Foundation Amino, SCP-872 | Wiki | SCP Foundation Amino, Horror Brawl Request 100: SCP-872 - DeviantArt, 75 Scarecrow ideas - Pinterest, SCP Readings: SCP-872 ""The Tattered Farmer"" - YouTube, Image Review 9 - SCP Sandbox Wiki II, Classic Folklore SCPs - Geeking Out about It - WordPress.com, Folk;ore - Geeking Out about It, SCP – Geeking Out about It - WordPress.com, November 2022 - Geeking Out about It, SCP Readings: SCP-1918 ""Tik Tak Tow"" - YouTube, SCP Foundation: Image Gallery - Page 18 - Know Your Meme, Tanhony - SCP Sandbox Wiki I"
A photograph shows an artist's conceptual rendering of a 'solar panda farm.,images/false_172.jpg,out-of-context,panda na china solar,"Giant panda, China, Solar energy, Photovoltaics, Power station, Photovoltaic power station, Renewable energy, Solar power, Energy, Solar Panel, , JinkoSolar, Solar cell, Xi'an LONGI Silicon Materials, Electricity","China just built a solar power array that looks like a panda | Vox, Panda-shaped solar power plant opens in China - AccuWeather, Panda Green surpasses 1.5GW of grid-connected solar assets, There's a solar farm in China shaped like a Panda. : r/pics - Reddit, Panda Green Energy completes first panda-shaped PV power plant, Introducing China's Solar Panda Power Plant, Is China's 'Panda Bear Solar Farm' Real? | Snopes.com, Influential think tank recommends 200GW solar target for China, 7 Interesting facts about Panda Power Plant - HavenHill Synergy Ltd., The Hungry Dragon: Explaining China's 50GW+ PV market in 2017, Aerial view of Panda Solar Farm - HavenHill Synergy Ltd., Brieuc Van Thienen (@BrieucVThienen) / X, China inaugura estação de energia solar em forma de panda, China ha construido una planta de energía solar con forma de panda, Planta solar con forma de oso panda inaugurada en China"
"A photograph shows three women posing to illustrate the use of a three-person cangue, a public humiliation device. Photographer William Saunders took the picture sometime between 1870 and 1880 in Shanghai.",images/false_174.jpg,out-of-context,monochrome,"Chakhundorji, Galdan Boshigt, Dolonnuur Assembly, Khalkha Mongols, Empresses in the Palace, Qing dynasty, Prisoner, History, Penal transportation, Mongolian, , Chinese, Manchu people","Халхын ноёд Манжид дагаар орсон өдөр - tugeene.mn, นักโทษจีนโบราณ ทีโดนเอาเเผ่นไม้มาสวมไว้ทีคอเวลานอนตอน ... - Pantip, นักโทษจีนโบราณ ทีโดนเอาเเผ่นไม้มาสวมไว้ทีคอเวลานอนตอน ... - Pantip, 奇聞秘史︱甄嬛全家被流放人間煉獄寧古塔女囚心寒經歷生不如死, 奇闻秘史︱甄嬛全家被流放人间炼狱宁古塔女囚心寒经历生不如死"
A still frame taken from the 2012 film Kingdom of Ants movie shows a boy after he was shot in the heart.,images/false_175.jpg,out-of-context,ricky boyz n the hood,"John Singleton, Morris Chestnut, Cuba Gooding Jr., Boyz n the Hood, Ricky Baker, Ice Cube, Hood, Menace II Society, Film director, African American cinema","TOP ""Ricky Gets Shot"" Reactions! Boyz N The Hood (1991) Movie ..., 10 Harsh Realities From 'Boyz N The Hood' That Still Resonate, Boyz N The Hood - Black Cinema Connection, From Boyz N The Hood To Numerous Projects, John Singleton Is ..., Laurence Fishburne - Black Cinema Connection, Tag: Cuba Gooding Jr. - Black Cinema Connection, Angela Bassett - Black Cinema Connection, About That Time Boyz N The Hood Set Off Gang Violence at Movie ..., John Singleton Raised Black Children Through Film, 25 Years Later, the Power and Brilliance of Boyz n the Hood Still ..., Biys in the hood on sale - dor-shadaresort.com, MORRIS CHESTNUT HAND SIGNED AUTHENTIC 'BOYZ N ... - eBay, Yo Frieza lets roll up an ice these fools. : r/dbz - Reddit, ViveTV on X: ""Which death made you cry? Ricky (boyz and the hood ..., Yo that's crazy - YouTube"
Photograph depicts a sign at a single Wegmans store informing customers purchasing pork or alcohol to choose another lane in 2012 to accommodate Muslim employees.,images/false_176.jpg,out-of-context,junk food,"Supermarket, Aldi, , ALDI, Retail, Cashier, Chain store","Aldi praised for allowing 'Muslim' checkout worker not to sell alcohol ..., Сеть супермаркетов выразила свое отношение к шариату"
Image shows German special forces wearing chainmail protective gear while heading into a situation that involves someone armed with a sharp stabbing or cutting weapon.,images/false_177.jpg,out-of-context,kevlar nylon,"Ballistic nylon, Kevlar, Nylon, Textile, Cordura, Shopping bag, Ballistics, Waterproof fabric, Polymer, Bag, Material, Bulletproof vest","Survival gear: Kevlar VS Ballistic nylon - YouTube, How Many Layers Of Ballistic Nylon Can Stop A Bullet ... - YouTube, AI is helping scientists develop lifechanging materials of the future, Future Archives - The Brighter Side of News, 840D double strand ballistic nylon oxford fabric with pu coated, NX4/JU6RO Nylon 1680D Twist oxford PU 2 times coating - YouTube, Nylon/shopping bag Body Armor? (Attempt 1) information gathering., Leading Ballistic Fabric Manufacturer and Supplier in China, Kingkoper : Bahan Ballistic Nylon / Asal usul Ballistic Nylon - YouTube"
"Photograph depicts a veteran being upset that he was behind the column of other veterans and could not catch up with them at a Victory Parade on May 9, 2007 in Russia.",images/false_179.jpg,out-of-context,military officer,"Army officer, Military uniform, Non-commissioned officer, Uniform",
"A photograph shows Senator John McCain posing with members of the Free Syrian Army (FSA) in May 2013,",images/false_180.jpg,out-of-context,protest,"John McCain, Muammar Gaddafi, Christopher Stevens, Benghazi, United States, United States Senator, Senator, National Transitional Council, , Fox News Sunday, 美國之音, Coalition","US Senator Visits Libya, Demands More Help for Rebels - VOA, McCain: 'Gadhafi May Crack' - VOA, From POW to presidential contender: John McCain's life in pictures, AS Sebut Oposisi Libya Kredibel, Tapi Tunda Pengakuan Diplomatik, Сенатор Маккейн встречается с ливийской оппозицией в Бенгази, Senator AS McCain Kunjungi Pemberontak Libya di Benghazi, Senator Fraksi Republik Inginkan Peran AS Lebih Besar dalam ..., 麥凱恩參議員抵達利比亞班加西 - 美國之音粵語網, سفر جان میکن به لیبیا, Diario della guerra in Libia - Il Post, جان مکېن لیبیا ته تللی دی"
A photograph shows Michelle Obama hugging a graduate from the NY City College Class of 2016 in June 2016.,images/false_181.jpg,out-of-context,philadelphia high school for girls,"Philadelphia High School For Girls, Young girl, School, Education, Secondary school, High school, , Sophomore, Student, High school student","Michelle Obama gives advice, hugs to Philly girls - WHYY, Michelle Obama gives advice, hugs to Philly girls - Chalkbeat, MEDIA & PRESS - African American Museum in Philadelphia, Michelle Obama, cavalcade of stars urge Philly students toward ..., Articles Archive - Page 1930 of 8653 - WHYY, Becoming — beGirl.world Global Scholars"
"An image of an actress pelted with eggs from La Rosa de Guadalupe, a Mexican drama series.",images/false_183.jpg,out-of-context,ruth kelly egged,"Ruth Kelly, Harold Wilson, Egg, United Kingdom, Custard, John Major, World Egg Day, Egging, Egg, Education, Duck, Politics, Photo agency, ","England | Manchester | Egg thrown at Kelly outside court - BBC News, Ruth Kelly struck by an egg! - The Pie & Piston Archive - PistonHeads, BBC NEWS | England | Manchester | Man admits Ruth Kelly egg attack, BBC NEWS | England | Manchester | Kelly egg thrower avoids prison, Ruth Kelly, Egg on face - Contractor UK Bulletin Board, Egg on your face – politicians under attack | Politics | The Guardian, Egg protester hi-res stock photography and images - Alamy, Simon coverdale hi-res stock photography and images - Alamy, It's World Egg Day so here are a load of politicians getting egged, Where ruth kelly Stock Photos and Images - Alamy, Ducks egg hi-res stock photography and images - Alamy, See pa story education kelly Stock Photos and Images - Alamy, In pictures: A history of politicians who've been egged - The Telegraph, Hit with eggs hi-res stock photography and images - Alamy, Salford magistrates court Stock Photos and Images - Alamy"
