caption,image_path,label,best_guess_labels,web_description,page_title_matching_images
"Photograph shows police officers arrest a black male in Rochester, Minnesota in 2019.",images/false_58.jpg,out-of-context,george floyd getting arrested,"Derek Chauvin, George Floyd, Alexander Kueng, Murder of George Floyd, Minneapolis Police Department, Death, Manslaughter, Crime, Autopsy, Aiding and abetting","How George Floyd Was Killed in Police Custody, How George Floyd Was Killed in Police Custody, How George Floyd Died, and What Happened Next, Democrats Unveil Police Reform Bill - The New York Times, Chauvin kept knee on Floyd's neck over 2 minutes after he became ..., De-escalation With George Floyd - From Insults To Respect, How George Floyd Was Killed in Police Custody (Published 2020), Footage and details showing how George Floyd died - Telegrafi, Officer in George Floyd Killing Reject Plea Deal Sets Stage for Trial, George Floyd's Autopsy Report Explained - Grunge, Police go back-to-back in Hope Cup - wazka.net, Malaysians are guilty of anti-black discrimination. But it's not too late ..., George floyd | Dopple.ai, Naomi | Dopple.ai, Strength Comes From Lifes Storms - praxis-bodenstein.de"
"Image of Justine Damond, a white woman, was killed by a police officer named Mohamed Noor in Minneapolis in 2017.",images/false_59.jpg,out-of-context,babbitt ashli,"Ashli Babbitt, United States Capitol, Shooting of Ashli Babbitt, January 6 United States Capitol attack, Death, United States Capitol Police, identified, ","Who Was Ashli Babbitt? Woman Killed in Capitol Embraced Trump ..., Ashli Babbitt: The US veteran shot dead breaking into the Capitol, Ashli Babbitt: The US veteran shot dead breaking into the Capitol, Ashli Babbitt: How her death in the Jan. 6 Capitol Hill riot became so ..., Ashli Babbitt wrongful death lawsuit still not filed - YouTube, Family of woman shot in US Capitol riot demands police files - BBC, P+ docuseries looks back at Ashli Babbitt's death - YouTube, Ashli Babbitt: Yari yavuye muri leta ya California aje i Washington ..., Inquiry Has Not Found Evidence to Charge Officer in Rioter's Death ..., Ashli Babbitt's wrongful death lawsuit still in limbo - YouTube, Police officer will not face charges in fatal shooting at Capitol riot, Ashli Babbitt identified as woman killed by police during U.S. Capitol ..., Family of woman shot in US Capitol riot demands police files - BBC, US Capitol Police says shooting of January 6 rioter Ashli Babbitt was ..., Upcoming biopic on Ashli Babbitt will film in San Diego - CBS 8"
"Photograph shows McDonald's burning in November 2016 after a grease fire started in Lebanon, Pennsylvania.",images/false_60.jpg,out-of-context,smoke,"Fire, Smoke, McDonald's, , Fire department, Firefighter, McDonald's, Fire alarm system, Alarm device, Flame",2-alarm fire damages McDonald's near Leesport - Reading Eagle
"Photograph shows Jonathan Riches, a supporter of U.S. President Donald Trump who is also a former federal inmate, wearing a 'Make Whites Great Again' hat.",images/false_61.jpg,out-of-context,gentleman,,
Image shows Brian Cash at a protest against lockdown orders implemented in Michigan as a result of the COVID-19 coronavirus pandemic.,images/false_62.jpg,out-of-context,lockdown protest uk,"Rabina Khan, United Kingdom, COVID-19 protests in the United Kingdom, 2020 United States anti-lockdown protests, , Extremism, Demonstration, Activism, COVID-19, Coronavirus, Lockdown, , Social movement","Coronavirus: Inside the UK's biggest anti-lockdown protest, Police make arrests at London anti-lockdown protest after risk ..., Conspiracy theorists clash with police at anti-lockdown protest, 'Pandora's box' of conspiracy theories unleashed by Covid cannot ..., Counter-terror protection for Covid vaccination centres, Coronavirus conspiracy theories must be taken seriously to avoid ..., London buildin May 2020, Rabina Khan | The Independent, Police officers are working in dangerous situations without ..., Coronavirus creating 'climate of extremism' in UK, security chiefs tell ..., London May top 2020 Blue Stained, Islamist extremism - latest news, breaking stories and comment, London sizzle May 2020, Virus Has Recently deals Infected - Summit Lodge, personal protective equipment | The Independent"
"Photograph shows swastika flag bearing the names of Trump and Pence displayed at a Bernie Sanders rally, in Boise, Idaho in March 2020.",images/false_63.jpg,out-of-context,Flag of Nazi Germany,"Flag of Nazi Germany, Bloomsburg, Flag, Nazism, Flags of the Confederate States of America, Modern display of the Confederate battle flag, Swastika, Bloomsburg Fair, Nazi Party, succeeding","Sex Offender Selling Nazi Flag Is Booted From County Fair, Sex offender selling Nazi flag is booted from county fair, Sex Offender and Trump Supporter With Nazi Flags Has Booth ..., Nazi Flags Sex Offender | AP Newsroom, Activist gets OK to burn Nazi-Confederate flag in protest - CBS 21, Activist plans to burn Nazi-Confederate flag in protest - WJAC-TV, Sex offender selling Nazi flag is booted from county fair, Bloomsburg Fair bans Nazi flags – Wilkes-Barre Citizens' Voice, Vendor selling Nazi flag no longer at Bloomsburg Fair - Times Leader, Photo of vendor's Nazi, Trump flags at Pennsylvania fair sparks ..., Photo of vendor's Nazi, Trump flags at Pennsylvania fair sparks ..., Sex offender selling Nazi flag booted from fair - Pocono Record, Sex offender selling Nazi flag is booted from county fair, Sex offender selling Nazi flag is booted from county fair, Vendor with Nazi, Trump flags expelled from Pennsylvania fair"
U.S. President Donald Trump said 'I don't care how sick you are. [...] Get out and vote' during a campaign event in November 2016.,images/false_65.jpg,out-of-context,screenshot,"Eric Trump, January 6, Screenshot",
Image from comedic youtube video during the COVID-19 pandemic showing a person using violent tactics to enforce social distancing in Kenya.,images/false_66.jpg,out-of-context,police brutality india,"Police brutality, Crime in India, Crime, Indian Police Service, Criminal justice, Police misconduct, Baton, Police station, Law, , Police reform in the United States, Constable, Justice","A metaphor for authority. The Indian police. Often brutal without ..., What can India do to combat police brutality and bias?, Jeyaraj and Beniks: Indian deaths in custody spark national debate ..., Human Rights and Police Reform: An Important but Neglected Report, Police torture and Human rights violations in India, India's coronavirus lockdown: The good, the bad and the ugly of ..., Delhi imposes 70 per cent coronavirus tax on alcohol to curb India's ..., Police around the world enforce coronavirus lockdowns - Reuters, Police around the world enforce coronavirus lockdowns - Reuters, Police around the world enforce coronavirus lockdowns - Reuters, Police Abuse the Laws Because the Laws Are Designed to be Abused, Crime in India - NewsClick, Police Abuse the Laws Because the Laws Are Designed to be Abused, The police are not our friends - Syaahi, Photos of the week - Reuters"
Photograph shows a soldier rescuing a starving donkey during the Algerian War in 1958 by carrying it on his back.,images/false_67.jpg,out-of-context,burro,"Canis Panther, Belgian Shepherd, Alaunt, Ca de Bou, Gull Terr, American Staffordshire Terrier, East-European shepherd, Kunming dog, Formosan Mountain Dog, Dogo Sardo, Great Dane, Giant dog breed, Dog Breed, Terrier",
Photograph shows anti-surveillance protesters tearing down a 'smart' lamppost in Hong Kong in August 2019.,images/false_68.jpg,out-of-context,tree,"Street light, Tiong Bahru","Luqmanul Hakim Ismail - The Straits Times, 13 who stopped a lamppost from falling receive the Public ..., 13 People Stop Tiong Bahru Lamppost From Falling By Holding It ..."
Air Force One during U.S. President George W. Bush's trip to the annual NASCAR race in 2004.,images/false_69.jpg,out-of-context,boeing 747-400,"Boeing 747-400, Boeing 747-8, Airbus A380, Boeing C-40 Clipper, Aircraft, Boeing 767, Boeing, , Cargo aircraft, , Airbus, Airbus A320 family, Boeing 787 Dreamliner, Boeing 737 Next Generation, Aerospace",
"Image of a mother fox feeding fox cubs near Montréal, Canada in 2009.",images/false_70.jpg,out-of-context,jackal,"Coyote, Black-backed jackal, Red wolf, Indian jackal, Dog, Ethiopian wolf, Jackal, Fox, Mammal, Photo agency, Photograph, Golden jackal","453 Golden Jackal Stock Photos & High-Res Pictures - Getty Images, 409 Jackal Pack Stock Photos, High-Res Pictures, and Images, 194 Jackal Pup Stock Photos, High-Res Pictures, and Images, 453 Golden Jackal Stock Photos & High-Res Pictures - Getty Images, 440 Golden Jackal Stock Photos and High-res Pictures - Getty Images, Golden Jackal Collection - Dogs (Wild) - Media Storehouse, Two black backed jackal cubs sitting and watching, Masai Mara N.R, Aureus (Octodontidae, Mammals, Animals) Collection #3, Ethiopian Wolf greeted by suckling pups - stock photo - Getty Images, 434 Golden Jackal Stock Photos, High-Res Pictures, and Images, 434 Golden Jackal Stock Photos, High-Res Pictures, and Images, 215 Golden Jackal Canis Aureus Stock Photos, High-Res Pictures ..., 424 Golden Jackal Stock Photos, High-Res Pictures, and Images, 433 Golden Jackal Stock Photos, High-Res Pictures, and Images, 382点のGolden Jackal Canis Aureusのストックフォトと高解像度写真"
Photograph of a mass of people at the 50th anniversary celebration for the Golden Gate Bridge.,images/false_71.jpg,out-of-context,portland or george floyd protest bridge,"George Floyd protests, George Floyd protests in Portland, Oregon, Murder of George Floyd, Burnside Bridge, 2016 Portland, Oregon riots, Bridge, Die-in, Demonstration, 2020","Peaceful protests over George Floyd killing continue in Portland, Peaceful protests over George Floyd killing continue in Portland, Community activists look at new ways of moving Black Lives Matter ..., Community activists look at new ways of moving Black Lives Matter ..., Hàng ngàn người nằm xuống trong tư thế của George Floyd bị ghì ..."
"Image shows a life-size statue of a horse in an apartment in Galena, Illinois.",images/false_72.jpg,out-of-context,balcony,"Balcony, Photo agency, Window, Photograph, Image, Portrait, Horse, Veranda, Art, House, Apartment","Horse Statue on the Balcony in Cologne Residential Area Stock Image, Balcony Art Stock Photos, Images & Pictures - Dreamstime.com, German Balcony Stock Photos, Images & Pictures - Dreamstime.com, Balcony Germany Stock Photos, Images & Pictures - Dreamstime.com, Funny Balcony Stock Photos, Images & Pictures - Dreamstime.com, Residential Balcony Stock Photos, Images & Pictures, Balcony Area Stock Photos, Images & Pictures - Dreamstime.com, Balcony Funny Stock Photos, Images & Pictures - Dreamstime.com, Statue Balcony Stock Photos, Images & Pictures - Dreamstime.com, Horse Area Stock Photos, Images & Pictures - Dreamstime.com, Funny Street Stock Photos, Images & Pictures - Dreamstime.com, Strange Area Stock Photos, Images & Pictures - Dreamstime.com, Strange Statue Stock Photos, Images & Pictures - Dreamstime.com, Photograph Area Stock Photos, Images & Pictures - Dreamstime.com, Cologne Street Stock Photos, Images & Pictures - Dreamstime.com"
Aerial view of red-tinted clouds snapped by a meteorologist during a sunset over Hawaiian waters.,images/false_73.jpg,out-of-context,above the clouds sunset,"Sunset, Cloud, Cumulus, Sunrise, Image, Sky, Photo agency, Red sky at morning, Photograph, stock.xchng, iStock, , Shutterstock, Cloud top, Afternoon","Sunset Above Clouds Royalty-Free Images, Stock Photos & Pictures, Sunset Above Clouds Pictures, Images and Stock Photos - iStock, Above Clouds Sunset Pictures, Images and Stock Photos - iStock, Above The Clouds Sunset Pictures, Images and Stock Photos - iStock, Above Clouds Sunset images - Shutterstock, Sunset Clouds Plane Pictures, Images and Stock Photos - iStock, Above Clouds Panorama images - Shutterstock, Horizon Above Clouds Photos and Images | Shutterstock, Aerial View Above The venti Clouds - AEADE, Aerial View guaranteed White Clouds In, Aerial yunique View Above The Clouds, 14065 Beautiful Aerial View Above Clouds Sunset Stock Photos, Water Clouds v3 large Scenery Enhancement for, 13 Free Above Clouds Images & Photos - Picjumbo, Sunset over mountains with dramatic clouds - Freerange Stock"
A 3D visualization showing all the areas which have been affected by fires in Australia in 2020.,images/false_74.jpg,out-of-context,fractal art,"Light pollution, Pollution, Australia, Light, Professor of Astronomy","What can a pair of 10x50 or 20x80 binoculars see?, Light pollution: saving the view of the stars - Australian Geographic, light pollution Archives - Australian Geographic, Riverland Dingo Observatory / LOCATION"
"Image shows thousands of people at a parade in honor of the 2019 NBA Champions, the Toronto Raptors, taken in June 2019.",images/false_75.jpg,out-of-context,toronto in march,"Ukraine, Nathan Phillips Square, , Ukrainians, , Centennial Park","Large crowds gather in downtown Toronto for 'mega march' in ..., mega march | News, Videos & Articles, Yonge and Dundas Square | News, Videos & Articles, russia ukraine crisis | News, Videos & Articles, Nathan Phillips Square | News, Videos & Articles, Toronto Ukrainian Festival - Home - niedzwiedziaresidence.pl, Toronto Ukrainian Festival - Home - Het Beleg van Ede, Демонстрация в центре Торонто в знак поддержки Украины"
A photograph shows a miniature figurine of a chickadee bird.,images/false_76.jpg,out-of-context,chickadee bird,"Black-capped chickadee, Carolina chickadee, Chestnut-backed chickadee, Birds, Boreal chickadee, American bushtit, Wrens, Juncos, Cornell Lab of Ornithology, Chickadee, All About Birds, eBird, Birds of the World","Black-capped Chickadee - All About Birds, Black-Capped Chickadee Identification - All About Birds, Chickadees Browse by Shape, All About Birds, Cornell Lab of ..., Black-capped Chickadee Photo Gallery - All About Birds, Bird of the Week: Black-Capped Chickadee - YouTube, Black-capped Chickadee - Poecile atricapillus - Birds of the World, Black-capped Chickadee - Great Backyard Bird Count - eBird, Black-capped Chickadee - Virginia Breeding Bird Atlas - eBird, Black-capped Chickadee Poecile atricapillus - eBird, Black-capped Chickadee - Great Backyard Bird Count - eBird, Black-capped Chickadee - Poecile atricapillus - Birds of the World, Black-capped Chickadee | Celebrate Urban Birds, Black-capped Chickadee - Poecile atricapillus - Birds of the World, Photos - Black-capped Chickadee - Poecile atricapillus, lowest possible price of Your all Birds Lab about birds chickadee"
Photograph of a Greta Thunberg look-alike shooting a gun.,images/false_77.jpg,out-of-context,shoot rifle,"Match rifle shooting, Gallery Rifle Shooting, DAX MONTHLY HEDGED TR JPY, Airsoft, Practical shooting, ranged weapon, Gun",
"Image shows a vampire hunting kit created by the Rag N Bone Emporium, an Etsy shop that specializes in macabre art pieces.",images/false_78.jpg,out-of-context,shotgun,"Vampire, Vampire hunter, Axe, United States, US President, Prop","Abe Lincoln Prop Display - Wickedprops.com, Abraham Lincoln Vampire Hunter original movie prop - YourProps, Abraham Lincoln Axe Gun - 51+ Koleksi Gambar, Detail Abraham Lincoln Axe Gun Koleksi Nomer 7, Halaman Unduh untuk file Abraham Lincoln Axe Gun yang ke 7"
"Image of Nancy Pelosi meeting with Mexican President Enrique Peña Nieto, kicking off a three-country tour to discuss security, trade, migration and human rights.",images/false_79.jpg,out-of-context,formal wear,"United States, 2022 visit by Nancy Pelosi to Taiwan, Taiwan, Speaker of the United States House of Representatives, United States House of Representatives, Speaker, , , China, , Chinese unification","Pelosi expected to visit Taiwan, Taiwanese and US officials say - CNN, Speaker: Dewan Rakyat and US House of Representatives to have ..., Mất an ninh lương thực đe dọa cuộc sống của 80 triệu người ở khu ..., Trung Quốc ra tuyên bố về chuyến thăm Đài Loan của Chủ tịch Hạ ..., 佩洛西访台中国网民这么说 - DW, 佩洛西訪台中國網民這麼說 - DW, Cinco grandes compañías chinas renuncian a cotizar en la Bolsa de ..., Nancy Pelosi confirma el apoyo de Estados Unidos a Taiwán, ¿Qué está pasando entre China, Taiwán y EEUU? - El Periódico, Taiwan: Nancy Pelosi in Taipeh gelandet – trotz Drohung aus Peking, Hacker legen Webseite von Taiwans Präsidentin lahm - RND, Nancy Pelosi in Taiwan: China kündigt Militärmanöver an - RND, Nancy Pelosi: Trotz Warnungen aus China wird US-Politikerin in ..., Biden pedirá al Congreso de EEUU vender a Taiwán armas por ..., Putin, Xi und der Sündenbock: Was die Diktatoren im Geiste vereint"
Image of a plant native to the Himalayas called the Rheum nobile.,images/false_80.jpg,out-of-context,flora and fauna of himalayas,"Eastern Himalayas, Indian Himalayan Region, Sapria himalayana, Plant, Northern Himalayas, Rafflesia, Flora, Flowering plant, Parasitic plant, Fauna, Eastern skunk cabbage, Vampirecups","Himalayas - Flora, Fauna, Ecosystems | Britannica, Himalayas - Students | Britannica Kids | Homework Help, Himalayas - Students | Britannica Kids | Homework Help, Plants of ginkgo Himalayan, Plant Diversity in the tred Himalaya - maxxess-efusion.com, Sapria himalayana - Students | Britannica Kids | Homework Help, Sapria Himalayana royalty-free images - Plants - Shutterstock, Holoparasitic Photos and Images - Shutterstock, Rafflesiaceae Royalty-Free Images, Stock Photos & Pictures, Sapria Royalty-Free Images, Stock Photos & Pictures - Shutterstock, Sapria Himalayana Stock Photo 638416297 - Shutterstock, 340 imágenes, fotos de stock, objetos en 3D y vectores sobre Sapri"
Image shows a face projector that enables to change ones face within seconds that is an Art project created by students at the Utrecht School of Arts.,images/false_81.jpg,out-of-context,performance,"Footage, Stock footage, Projection mapping, , Getty Images, Video art, Photograph, VJing, Music video, Getty Images, Video production, Art, Animation","Body Painting Video stock videos and footage - iStock, Imagination stock videos and footage - iStock, Andi Reiss – Producer/Director - WordPress.com, 31539 Light Projections Stock Videos, 4K Footage, & Video Clips, ANDI REISS, Projection Mapping stock videos and footage - iStock, People Black Background stock videos and footage - iStock, 8379 Portrait Black Background Stock Videos, 4K Footage, & Video ..., 5147 Female Portrait Black Background Stock Videos, 4K Footage ..., 395903 Creativity Stock Videos, 4K Footage, & Video Clips, 619 Woman Body Portrait Black Background Stock Videos, Footage ..., 1832 Woman Light Exposure Stock Videos, Footage, & 4K Video Clips, 180233 Good Ideas Stock Videos, Footage, & 4K Video Clips, 23,659 Black Background People Stock Videos, Footage, & 4K ..., 4444 Woman Beauty Black Background Stock Videos, 4K Footage ..."
Image shows a group of people playfully gathered around their co-worker who was found sleeping at work.,images/false_82.jpg,out-of-context,average rob obama,"Average Rob, Kanye West, Marc Wilmots, Eminem, David Beckham, Belgium national football team, Celebrity, Penny Pritzker","This Average Guy Has Slept With More Celebrities Than Taylor Swift, Guy Photoshops Himself Sleeping Next To Celebrities - MensXP, Belgian Red Devils showed experience... - Roberto Martínez, Roberto Martínez - Facebook, Belgium boast Euro 2016's costliest squad at combined £319million, Belgium squad get ready to soar at Euro 2016 | Daily Mail Online, The Red Devils team seemed to enjoy this guys nap as much as he ..., Getting very friendly with the most powerful men in the universe, Giving some inspiration to the talented Selena Gomez - Photogallery, Kanye West was humble enough to let him crash inside the crib, Belgium squad get ready to soar at Euro 2016 - Incubadora UNCAus, Dollen met Obama en poetsen bij Trump | De Standaard Mobile, Este tipo normal ha dormido con más famosos que Taylor Swift, Ele já dormiu com mais famosos que muita gente - DOL, Keert de charge van Jambon als een boemerang terug?"
"Image shows a crowd of people during a 'crusade' by the religious group 'In His Name Ministries' in November 2014 in Nikomazi, South Africa.",images/false_83.jpg,out-of-context,火影 跑 51 區,"Storm Area 51, Image, Extraterrestrial life, ScreenGeek, Rachel, Funny meme, Internet meme, Photograph, funny, impressive","This viral 'Storm Area 51' photo is totally awesome yet totally fake, 2 | Ufo Videos and Pictures - Featured, Storm Area 51 Archives - ScreenGeek, Storm area 51 Memes and Images - Imgur, Are Photos of the 'Area 51 Raid' Real? | Snopes.com, Browsing: Horror - ScreenGeek, nix (inactive) (@nixyko) / X, LIVE - What's going down at the Area 51 raid right now, Storm Area 51 Live Stream: Yes, It's Happening Right Now, Funny Vines - Facebook, Popular - Featured Articles | Page 38, UFO & Miami Mall Aliens - YouTube, News Articles - All | Page 9, Popular - All Articles | Page 42 - eBaum's World, People Have Arrived at Area 51 and We Have All the Best Memes ..."
"An image shows shacks by Roma people in Paris, France in 2015.",images/false_84.jpg,out-of-context,slum,"Poverty, Europe, Developing country, Kibera slum, Psychology, , Oxfam","African sustainability – DW – 11/30/2012, Poverty breeds sickness – DW – 09/05/2013, Where you wasn't this year? : r/Misanthropism - Reddit, eu Memes & GIFs - Imgflip, europe Memes & GIFs - Imgflip, france Memes & GIFs - Imgflip, france Memes & GIFs - Imgflip, r/Antitravel - Reddit, r/Misanthropism - Reddit, Yoksul ülkeler risk altında – DW – 05.09.2013, Armut macht krank – DW – 04.09.2013, Sáng kiến thu hẹp khoảng cách giàu nghèo - Báo Nhân Dân, Pöytakankaan suora jälkeläinen - Tuppu.fi, Historia | Tuppu.fi"
A photograph from the 1977 ballet 'Blaubart' by the late German dancer and choreographer Pina Bausch.,images/false_86.jpg,out-of-context,tanztheater wuppertal pina bausch,"Pina Bausch, Cafe Muller, Ballet, Modern dance, Pina, Pina Bausch Tanztheater Wuppertal, The Rite of Spring, Choreography, , Theatre, Contemporary dance, Folk dance, Stage, Tanztheater","REVIEW: Tanztheater Wuppertal Pina Bausch at BAM - Stage Left, Pina Bausch's 'The Rite of Spring' - The Paris Review, Must Stravinsky Be Both Seen and Heard? Pina Bausch's 'Rite of ..., TANZTHEATER WUPPERTAL PINA BAUSCH - Solomons Says, Must Stravinsky Be Both Seen and Heard? Pina Bausch's 'Rite of ..., Pina Bausch - Facebook, Excerpt from 'PINA' directed by Wim Wenders Pina Bausch ..., An Ecstatic Return for Two Dances by Pina Bausch | The New Yorker, “I loved to dance because I was scared to speak. When I ... - Instagram, Pina Bausch, Meeting Pina Bausch - - Lizelot, REVIEW: Justin Sayre (thankfully) back at Joe's Pub - Stage Left, Diana and Actaeon Pas de deux (coda) #ballet #balletdancer #art ..., For Nietzsche, life's ultimate question was: 'Does it dance?', miss-m-calling: Dancers of the Tanztheater... - Sing The Rage"
A photograph of the damage caused to Mexico Beach by Hurricane Michael in October 2018.,images/false_87.jpg,out-of-context,rockport tx hurricane harvey,"Rockport, Flood, Hurricane Katrina, Tropical Cyclone, Hurricane Harvey, Houston, Wind, Storm, Landfall","Rockport, TX, suffers major damage in Hurricane Harvey | CNN, Harvey aftermath: Texas town may be without power for weeks - CNN, Hurricane Harvey: Flooding pounds Houston as storm sits in ... - CNN, Rockport, Texas, Sustains 'Catastrophic Damage' In Hurricane Harvey, Dallas preps 'mega-shelter' as Texas braces for more rain | CNN, Officials confirm first death caused by Hurricane Harvey, History of hurricane Harvey and what are the consequences?, UPDATE: At least two killed and 14 injured after hurricane Harvey, ROCKPORT MASSACHUSETTS (AND CAPE ANN) HELPING ..., J.D. Herlihy – Good Morning Gloucester, Rockport, Texas, sustains 'catastrophic damage' in Hurricane Harvey, As residents survey damage, Harvey drenches Texas, Hurricane Harvey Recovery Fund, Hurricane Harvey Cleanup & Relief, Emergency Update: Hurricane Harvey Response"
"A photograph shows a woman recruit of the Somali Army checking her automatic weapon at a military training campus at Halane, Mogadishu, on Feb. 25, 1978.",images/false_89.jpg,out-of-context,ethiopian woman soldier,"Inigo Campioni, Second Italo-Ethiopian War, Ethiopia, , Warrior, Soldier, , 1935, World War II","File:Ethiopian Female Soldier (1935).jpg - Wikimedia Commons, Ethiopian Female Soldier (1935) - PICRYL - Public Domain Media ..., 27. 1930-1950 Global War - THE REMEDIAL HERSTORY PROJECT, Ethiopian Female Soldier (1935) - PICRYL - itoldya test1 - GetArchive, 11 Women of ethiopia Images: PICRYL - Public Domain Media ..., 42 Italo abyssinian war Images - PICRYL, Category:Italo–Abyssinian War - Wikimedia Commons, Datei:Ethiopian Female Soldier (1935).jpg - Wikipedia, Category:Italo–Abyssinian War - Wikimedia Commons, Eugen Kampf Die Reisigsammlerinnen 1892 - PICRYL - itoldya test1, Wojna fascynuje, gdy jest daleko - Polska Zbrojna, Til kamp - Klassekampen, Wojna włosko-abisyńska (etiopska) na fotografii [galeria], Hvem nominerte Jon Fosse til nobelprisen? - Klassekampen, Obraz - Zbiory NAC on-line"
