caption,image_path,label,best_guess_labels,web_description,page_title_matching_images
"An image of a traffic jam on a Crimean bridge while people trying to move towards the Crimean peninsula on July 16, 2022.",images/false_244.jpg,out-of-context,european traffic,"Traffic, Traffic congestion, Car, Moscow, Road, Saint Petersburg, Highway, Capital, Controlled-access highway, Transport, City, Street, Overpass","Moscow and St. Petersburg Lead Europe in Traffic Jams, Moscow and St. Petersburg Lead Europe in Traffic Jams, Central Bank Urges Conservative Approach to Russia's Reserves, Top 10 Cities With Worst Traffic Jams During Rush Hour In 2017, Opera - The Moscow Times, போக்குவரத்து நெரிசலில் மிக மோசமான உலகின் டாப், 10 Bandar Ni Antara Yang Paling Teruk 'Sangkut' Atas Jalan Raya ..., 10 Bandar Ni Antara Yang Paling Teruk 'Sangkut' Atas Jalan Raya ..., 7 Kesesakan Lalu Lintas Paling Lama Dalam Sejarah. Dia Punya ..., सड़कों पर ही नहीं एक दिन देश के बड़े भू-भाग पर कब्जा कर लेंगी गाड़ियां, Европски градови со најголем сообраќаен метеж - Москва на врвот, Trafik në Tiranë? Lista me 10 qytetet më trafikun me të rënduar në botë, Korang Rasa KL Sesak? Ini Ada 10 Bandar Lagi Teruk Sewaktu ..., 10 رخداد عجیب ترافیکی که دنیا را شوکه کرد - تین نیوز, Как убить двигатель, поменяв масло - Дром"
"Image of mass gathering during a rally in support of Imran Khan in Lahore, Pakistan at a Tehreek-e-Insaf in April 2018.",images/false_245.jpg,out-of-context,karachi protests,"Islamabad, , Rawalpindi","Road Blocked | Protests in Karachi | Dunya News - YouTube, Karachi Protest - Roads Blocked - Breaking news - 24 News HD, Protesters gather in Karachi, Islamabad for anti-America rallies - Dawn, Protests continue at various places in Karachi | 11 PM - YouTube, 24 News HD - YouTube, Disclosure of the alleged inhuman treatment of a Pakistani ..., Shoaib Akhtar aka Rawalpindi Express exclusively celebrates his ..., Abhi Na Jao Chor Kar | Ayesha Jahanzaib & Adeel Barki - YouTube, Pakistan Won The Final Match | T20 Tri-series | PAK vs NZ | Haris Rauf, Yoga, New Interest of Tooba, Sadia - YouTube, Jalal Chandio Vol 165 || Nibhain Haan Mosan Yari Hayati Kujh ..."
Photograph of truckers with Brazilian flags demonstrating in support of the Brazilian President Jair Bolsonaro's attacks on Brazil's Supreme Court and voting system in September 2021.,images/false_247.jpg,out-of-context,crowd,"Dilma Rousseff, Brazilian presidential election, Brazil, Tom Hennigan, Politics, 2022–2023 Brazilian election protests, President of Brazil, Far-right politics, , Electoral fraud","Lula: the rise and fall and rise again of Brazil's president-elect, 'It will be extremely close': bellwether state holds key to Brazil election, 'Lula represents hope': Brazil presidential frontrunner takes his ..., World leaders rush to congratulate Lula on Brazil election victory, Brazil judge orders police to clear roadblocks by pro-Bolsonaro ..., Bolsonaro breaks election silence but refuses to recognise Lula's ..., 'It's over': Jair Bolsonaro reportedly accepts defeat in Brazil election, Lula stages astonishing comeback to beat far-right Bolsonaro in ..., 'We are for democracy': Brazil football fans clear pro-Bolsonaro ..., Lula brands Bolsonaro 'tiny little dictator' in Brazil TV debate, Fears Bolsonaro may not accept defeat as son cries fraud before ..., Bolsonaro increasingly isolated as Brazil protests continue, Tom Hennigan - The Irish Times, Lula triumphs over far-right incumbent Bolsonaro in stunning ..., Lula triumphs over far-right incumbent Bolsonaro in stunning ..."
A digital artwork of a hurricane over Miami that was created by artist Brent Shavnore in 2019.,images/false_249.jpg,out-of-context,miami hurricane,"Lightning, Storm, Lightning strike, Thunderstorm, Weather, Tropical Cyclone, Rain, Meteorology, Atlantic hurricane season, Hail, Storm surge, Lightning rod, Tornado, Weather forecasting, Cloud","When is the Miami Hurricane Season? | All Nation Insurance, Nelly Bakhtadze - Infosys | LinkedIn, Download Storm Royalty-Free Photos, Illustrations, and Vectors, Download Thunderstorm Royalty-Free Photos, Illustrations, and ..., Met Office Academic Partnership - moap - University of Birmingham, The Reality of Climate Change - Andrew Stewart - LinkedIn, Kulea Ukulele - YouTube, Download Weather Royalty-Free Photos, Illustrations, and Vectors, Weather the Storm - Storyblocks, See you Again (with Lyrics) - Ukulele play along (Am, C, F, Dm, and G), Andrew Stewart | LinkedIn, Roof Lightning Protection Systems for Commercial Buildings - IKO, Heat Waves (with Lyrics) - Ukulele play along (Dm, C, Am, G, and F), Intellicenter Load Center Electrical Questions RE: Surge Protection, Aquastream Water Solutions - Facebook"
An image of Russian President Vladimir Putin wearing a tight suit jacket that crinkles in August 2017.,images/false_250.jpg,out-of-context,vladimir putin critically ill,"Russia, Russian invasion of Ukraine, President of Russia, , Ukraine, Russian oligarchs, Economy of Russia, Business oligarch, ","Russian Agents 'Believe Putin Is Terminally Ill' After Top-Secret ..., Russian agents ""believe that Putin is in serious health condition"", Bombshell leaked spy docs suggest Putin DOES have Parkinson's ..., 'Delusional' Putin showing signs of 'brain tumour or multiple ..., 'Delusional' Putin showing signs of 'brain tumour or ... - The US Sun, Bombshell leaked spy docs suggest Putin DOES have Parkinson's ..., 'Delusional' Putin showing signs of 'brain tumour or multiple ..., Putin 'high on speed' in meetings as tyrant is riddled with cancer ..., Bombshell leaked spy docs suggest Putin DOES have Parkinson's ..., Putin 'high on speed' in meetings as tyrant is riddled with cancer ..., Ukrainian National News Agency - Ukrinform, KALEV STOICESCU Putini kõne esitas konspiratsiooniteooria, Agjentët rusë ""besojnë se Putini është në gjendje të rëndë ..., Vohunski dokumenti: Ali ti res razkrivajo, da Putin boleha za ..., Putin hat Krebs und Parkinson? Das sagen Fachleute zum Verdacht"
"An image of Supreme Court Justice Clarence Thomas with his wife, Ginni Thomas, holding a bottle of wine was captured in September 2018 after hiring Crystal Clanton to assist her media ventures.",images/false_251.jpg,out-of-context,senior citizen,"Virginia Thomas, Clarence Thomas, Greg McCortney, Supreme Court of the United States, Judge, Court","How Alicia Shepard Wanted to Be Remembered - journal-isms.com, A First: NABJ Ousts Philly President - journal-isms.com, Surprise! Voters sent some Oklahoma lawmakers packing - Raw Story, Court hearing devolves into a 'mess' as 'Helmet boy' Capitol rioter ..., WATCH: Angela Rye absolutely destroys CNN conservative who ..., Ginni Thomas 'Intertwined' With 'Vast' Campaign Pressuring ..., In Strange Move Clarence Thomas – Not Chief Justice Roberts, Clarence Thomas Blasted for Declaring SCOTUS Can't Be 'Bullied ..., Clarence Thomas And His Family, Ginni Thomas was a 'shill' for her husband in Jan. 6 testimony, Nakababahalang sulat ni Ginni Thomas na nagsasabing ang mga ..."
A photograph of a police officer wielding a baton while holding an individual down by their head during clearing of a homeless camp in Toronto in July 2021.,images/false_252.jpg,out-of-context,joseph bologna philadelphia,"Joseph Bologna, Philadelphia, , Philadelphia Police Department, Philadelphia Police, Crime, Inspector, Baton, Police misconduct, Use of force, Commander, Assault","Philly police commander seen beating protesters faces aggravated ..., Cops Saluted And Applauded An Officer Facing Assault Charges ..., Philly DA vows to refile charges against fired police inspector after ..., Judge reinstates simple assault charge against ex-Philly police officer, Philadelphia police inspector surrenders to face charges of ... - CNN, Philly DA's office refiles charges against police inspector shown ..., After reviewing video, prosecutors charge police inspector instead of ..., Former PPD inspector hit with civil rights lawsuit following 2020 ..., A Philadelphia Police Inspector Was Charged With Assault For ..., Philadelphia cop is CHEERED by 100 of his colleagues as he ..., Philadelphia police inspector is charged with aggravated assault, Videos of alleged police misconduct went viral. Then what happened?, Philly police commander seen beating protesters to face aggravated ..., A week that changed Philadelphia: How the George Floyd protests ..., Philadelphia police inspector is charged with aggravated assault"
"Photograph of Ukrainian ambassador Sergiy Korsunsky clothed in Samurai armor while visiting Japan on February 14, 2022.",images/false_253.jpg,out-of-context,event,"Nenad Glišić, Nanbata Castle Park, Serbia, , Samurai, Serbian, , Park, Ambassador","'Serbian samurai' grabs attention at local Saitama Pref. festival, 難波田城公園まつり：セルビア大使も「サムライ」姿で参加 - 毎日新聞, nikola على X: ""Ambasadorske uniforme Ujedinjenog Kraljevstva ..."
A photograph of a riot police officer with his boot on the shoulder of a protester in 2010 during protests over a G20 summit in Toronto.,images/false_254.jpg,out-of-context,combat medic,"Belarus, United States, , , US President, , Human rights, Politics, Voice of America","Belarus Review Daily – November 5, 2020 - iSANS, Protesters freed from Belarus jails recount brutal beatings by police, Police pants clearance near me - Dr Rajan Grover, FN: Situasjonen i Hviterussland blir stadig dårligere - Aftenposten, Internett bekymrer mange lands ledere. I Turkmenistan må folket ..., Голос Америки - Спецдокладчик ООН по правам человека в..., Голос Америки - Facebook, Голос Америки (@golosameriki) • Instagram फ़ोटो और वीडियो, Nach Wahl: EU droht Weißrussland mit Sanktionen - news.ORF.at, Президент США Дональд Трамп заявил в Давосе, что хочет в ..., Этот год был полон новостей, произошедших в США, но ..., Спецдокладчик ООН по правам человека в Беларуси Нилс ..., Jak białoruskie służby wymuszają zeznania na opozycjonistach, अमेरिका ने अपने नागरिकों को दी चेतावनी, बांग्लादेश समेत इन देशों की यात्रा ..., Полацк Наваполацк Грамадскае Жыццё - Facebook"
"Photograph shows former heavyweight champion boxer Vitali Klitschko, who is serving as Kyiv’s mayor, in combat dress, down on one knee and holding a machine gun during a combat training day in Ukraine’s Chernihiv region in March 2021.",images/false_255.jpg,out-of-context,mexican marine,"United States Naval Academy, Marines, Naval Infantry Corps, United States Marine Corps, , Mexican Navy, Infantry, Navy, , Mexican Armed Forces, United States Southern Command, Soldier, Wasp-class amphibious assault ship","180620-N-RG360-1014 - SouthCom, 111 Mexican marines Images: PICRYL - Collections, 111 Mexican Marines Image - collections, File:Joint Assault EX at Tradewinds 2018 180620-N-RG360-1065.jpg, 224 Nassau bahamas Images: PICRYL - Public Domain Media ..., 180620-N-RG360-1065 NASSAU, Bahamas (June 20, 2018), 73 Tw 18 Image: PICRYL - Collections - GetArchive, 1667 Nrnpase W Image: PICRYL - Collections - GetArchive, Archivo:Joint Assault EX at Tradewinds 2018 180620-N-RG360 ..., Miembro de la... - Sorpresa,Velocidad y Violencia en Acción, SIG Sauer SIG516 - Wikiwand"
"Photo of a Ukrainian jet flying so low that it collected a road sign during a military exercise on August 27, 2020.",images/false_256.jpg,out-of-context,saab jas 39 gripen,"Jet aircraft, Aircraft, Airplane, Aero L-39 Albatros, Lockheed F-104 Starfighter, Saab JAS 39 Gripen, Aero L-29 Delfín, CASA C-101 Aviojet, Lockheed Martin, Flight, , Attack aircraft, Rocket-powered aircraft, Aviation","Şölen Mailoğlu (lenmailolu) - Profile - Pinterest, Ultimate Low Flying Jets | WordlessTech"
"Photograph shows people in Ukrainian city of Kharkiv, kneeling and praying in the snow in September 2019. The prayer group began meeting in 2014, following military action by separatists.",images/false_257.jpg,out-of-context,islam uni soviet,"Friday prayer, , Islamic art, Islamic architecture, Islampos, Ritual","The Changing Face of Islam in Russia - Georgia Political Review, Inspirational islamic pictures - Facebook, Islam | Inspiring Karachi | Page 3, Friday prayer in... - Inspirational islamic pictures - Facebook, US NGOs and Central Asia - Military Review, Kazakhstan Jum'a (Friday) Prayer in the Snow..., @joystonia on Tumblr, mywudhucompanion • Instagram photos and videos, wab155 | Flickr, عبو khalil - غعغع - Bayt.com People, تفيده kamel - فغقف - Bayt.com People, سوسو kamal - قفغقفغ - Bayt.com People, Ketika Al Quran Diam-diam Diajarkan Di Uni Soviet - Islampos, Kazakhstan, Islam Berakar Kuat dalam Tradisi (1) | Republika Online, Kazakhstan, Islam Berakar Kuat dalam Tradisi (3-habis) - Khazanah"
"Image shows Klaus Schwab, founder of the World Economic Forum, with U2 front man Bono, heading to the 'Special 10th Anniversary Celebration of the (RED) Campaign' during the WEF annual meeting in Davos January 22, 2016.",images/false_259.jpg,out-of-context,bono medvedev,"Dmitry Medvedev, Bono, Russia, U2, Rock, Bocharov Ruchey, Lead vocalist, , Rossiya Segodnya, President of Russia, Frontman, The Beatles","Bono and Dmitry Medvedev Talk Rock Music, Fight Against AIDS ..., Dmitry Medvedev meets U2 frontman Bono - Sputnik Mediabank, Добрый молодец: Боно и его неустанная работа на благо мира, Д.Медведев и Боно встретились за чашкой чая в Сочи - РБК, Д.Медведев встретился с Боно - РИА Новости Медиабанк, Д.Медведев встретился с Боно - РИА Новости Медиабанк"
"An image shows a Russian helicopter downed in Ukraine on February 25, 2022.",images/false_260.jpg,out-of-context,pearl harbor helicopter crash,"Helicopter, USS Arizona Memorial, Attack on Pearl Harbor, Aircraft, Phoenix news helicopter collision, Sikorsky S-70, Bell 214, Pearl Harbor National Memorial, Bell Boeing V-22 Osprey, Helicopter rotor, Military helicopter","Helicopter Crashes Near Pearl Harbor Memorial, 1 in Critical ..., NTSB Investigating Helicopter Crash in Pearl Harbor - ABC News, Tourists Describe Moment Pearl Harbor Helicopter 'Fell Out of the Sky', WATCH: Tourist Helicopter Crashes Near Arizona Memorial, Civilian helicopter crashes near Pearl Harbor Memorial | whas11.com, Helicopter suddenly crash into the lake - YouTube, CRASH - YouTube, Video yainasa helicopter ikianguka ufukweni mwa Pearl Harbor ..., Vituko - Facebook, Côte d'Ivoire: Crash (encore) d'un hélicoptère français à Alépé, BlogSy Tanzania - Facebook, BlogSy Tanzania - Facebook, Un accident d'hélicoptère fait sept morts dans le sud de l'Italie | FratMat, Abidjan : suivez l'actualité de la Côte d'Ivoire en live - Afrique sur 7, Abidjan : suivez l'actualité de la Côte d'Ivoire en live - Afrique sur 7"
"Photograph shows a Soviet Union flag raised on a flagpole by Prizrak Brigade, a Communist militiaman, in Debaltseve, Ukraine in March 2015.",images/false_261.jpg,out-of-context,ussr flag in ukraine,"Kherson, Russia, Flag, Southern Ukraine, , , Flag of the Soviet Union, Donbas, Russo-Ukrainian War, Flag of Russia, , National flag","Moscow-Installed Officials Try to Solidify Rule in Parts of Southern ..., Moscow-Installed Officials Try to Solidify Rule in Parts of Southern ..., Ukraine's colonisation begins with its Internet | RSF, Soviet Flag Get File - Colab, Russia Tightens Grip on Ukraine's Sievierodonetsk - VOA, Pro-Russian Separatists Uphold Foreigners' Death Sentences - VOA, Fierce street-by-street combat continues in Sievierodonetsk, Russian discount soviet flag, La colonisation de l'Ukraine commence par son réseau - RSF, La colonisation de l'Ukraine commence par son réseau - RSF, Un général russe tué en Ukraine | France Culture, Un Français tué au combat en Ukraine - Radio France, Intenses combats dans le sud de l'Ukraine, menace nucléaire à ..., Ukraine : un cadre russe, ancien député ukrainien pro-Zelensky, tué ..., EN DIRECT - Des restrictions d'électricité à partir de jeudi en Ukraine"
Image showing a group of truckers starting their workday with a prayer in March 2020 in Honduras.,images/false_262.jpg,out-of-context,citroën h van,"Van, Citroën H Van, Peugeot 301, Citroën, Isuzu Forward, Austin A35, Isuzu Motors Ltd., Ford Anglia, BMW, Truck, RV, , , rig, ",
"A photo illustrating reports about Turkish air strikes on the Batifa, a Kurdish district in northern Iraq in 2020.",images/false_263.jpg,out-of-context,flame,"Russia, , , Unmanned aerial vehicle, Kyiv, Netherlands, Rocket","Russia | Page 15 of 29 - The War Zone, Ukraine Situation Report: Storms Held Up Russian Assault On ..., Ukraine Strikes Back: Multiple Explosions Rock Russian Border Towns, Russia Is Firing North Korean Ballistic Missiles At Ukraine, 2023 Light blitzed Blue Men, Ukrainian drones struck a substation in Russia's Bryansk region ..., THẾ GIỚI | VOV.VN, NATO gia tăng robot chiến đấu để đối phó Nga ở Đông Âu - VOV, Diễn biến chính tình hình chiến sự Nga Ukraine ngày 17/10 - VOV, UAV sát thủ cảm tử được Nga và Ukraine sử dụng thế nào trong ..., Comptines Pour Faire rubberier La Fête, Combinaisons Pour Femmes Barboteuses rustbelt Ski, У росії заявили про атаку понад 30 українських безпілотників, У Нижньогородській області рф пролунали вибухи - Слово і Діло, У російському Липецьку пролунали вибухи та спалахнула пожежа ..."
"A photograph of large waves crashing ashore in Sennen, Cornwall, England, in February 2014.",images/false_264.jpg,out-of-context,storm big waves,"Storm, Wind wave, Wind, Gale, Winter storm, Weather, Swell, Rain, Sea, Low-pressure area, Severe weather, Cyclone, Wave, Met Office, Tide","Huge waves pummel shores near U.K. town during storm, 'Winter Storm Hercules' brings surfers 27ft waves - NZ Herald, Monster waves slam into UK after US storm - Foster's Daily Democrat, Large waves storm Black and White Stock Photos & Images - Alamy, UK weather: London battered by gales as more floods set to hit in, Monster waves batter Britain - World News - NZ Herald, Huge waves with people Black & White Stock Photos - Alamy, High storm winds Black and White Stock Photos & Images - Alamy, High tide porthcawl hi-res stock photography and images - Alamy, Wales weather: Homes, student halls and businesses on ..., Explainer: what causes winter storms? - The Conversation, Further flooding expected as UK gets back to work - Lancs Live, Aberystwyth Evacuation - Wales Online, Further flooding expected as UK gets back to work - Surrey Live, Climate change impacts 'might already be considered dangerous'"
"Image shows fires burning and smoke billowing over Kyiv’s Independence Square after demonstrations against then president Viktor Yanukovich on February 19, 2014.",images/false_265.jpg,out-of-context,kharkiv ukraine war,"Kharkiv, Russia, Russian invasion of Ukraine, Russo-Ukrainian War, , , Eastern Ukraine, , Kyiv","Russia's Airborne Troops Land In Kharkiv City: Ukraine's Army - NDTV, ICC: civil society from Ukraine, Russia, Belarus and beyond calls for ..., Inside Kharkiv: the city paying 'hideous cost' of Ukraine war | The Week, Russia Pounds 30 Towns and Villages in Ukraine's Kharkiv Region, International Criminal Court to investigate alleged war crimes by ..., Putin Reaches for the Syria Playbook as Ukraine Invasion Stalls, Russian forces target major cities, take out important infrastructure, Over 500 Civilians Killed In Ukraine's Kharkiv Since Russian Invasion, Russia Ukraine Vladimir Putin: African kontris come under fire ... - BBC, Ukraine can 'absolutely' win against Russia - US Sec of State - RNZ, Russian paratroopers land in Ukraine's second largest city - RNZ, 10 days of suffering. Russia's war against Ukraine in photos, Jack Losh - Foreign Policy, Russian Forces Shell Ukraine's Second-Largest City - Caspian News, 70 Ukrainian servicemen killed by Russian shelling of military base"
"Image shows a large crowd gathered during Woodstock Music and Arts Festival in New York, 1969.",images/false_266.jpg,out-of-context,woodstock 99 crowd,"Woodstock, Woodstock '99, Woodstock 99, , Limp Bizkit, Festival, Concert, Audience, Music Festival, John Scher, Crowd surfing, Korn","Woodstock '99 photos - Syracuse.com, Woodstock '99: New Netflix docuseries blames CNY 'trainwreck' on ..., 'Woodstock '99' documentary: It's not just Limp Bizkit's fault, Woodstock '99 legacy: A lawsuit, and a mother shattered - Pinterest, A return to the site of Woodstock '99 a decade later, Griffiss is quiet ..., Pay Phones at Woodstock 99 Photograph by Concert Photos - Pixels, woodstock '99 — Festival News - Music, Art, Food, Comedy, Film ..., Woodstock '99 - The Day the 90's Died - Festival News Update, Into the Woodstock Crowd, 1969 - Pinterest, MTV — Festival News - Music, Art, Food, Comedy, Film and More, Let's talk about Woodstock '99 | Laura Aucott - LinkedIn, rape — Festival News - Music, Art, Food, Comedy, Film and More, Woodstock '99 legacy: A lawsuit, and a mother shattered - Pinterest, Woodstock '99: Netflix to revisit disastrous CNY music festival, When DMX performed in front of... - Golden Era Hip Hop | Facebook"
Photograph shows a demonstration in Paris over pension reforms that took place in early 2020.,images/false_267.jpg,out-of-context,crowd,,
"An image shows Belarus prison doctor examines a prisoner covered with Nazi tattoos at the 15th prison in the town of Mogilyev, Belarus in June 2005.",images/false_269.jpg,out-of-context,surgeon,"Surgery, Hospital, Operating theater, Scrubs, Surgeon, Health care, Medical glove, Patient gown, Surgical instrument, Medicine, Health, Gown, Health care provider, Medical procedure, Patient",
"Image shows a worker of the county’s Elections Department during counting ballot at the Maricopa County Tabulation and Election Center on November 9, 2022.",images/false_270.jpg,out-of-context,election clerk,"United States, Finnish presidential election, Suffrage, Absentee ballot, Ballot, Virginia Department of Elections, , Politics, Early voting, Democracy, Voter registration, Midterm election","Handwriting Disputes Cause Headaches for Some Absentee Voters, How to Vote as an American Living Abroad - The New York Times, Latino candidates battle to emerge at top in crowded California ..., The Ins and Outs of Voting by Mail in Herndon, VA, Voting in 2024 U.S. Federal Elections - U.S. Embassy & Consulate, ABD'de Posta Yoluyla Oy Kullanma Tartışmaları Sürüyor - VOA Türkçe"
A photo shows 17-year-old Fin Doherty tearing up. Fin followed in the footsteps of his slain brother who died in Afghanistan.,images/false_271.jpg,out-of-context,Photo agency,"Photo agency, Portrait, Photograph, Soldier, Image, Photography, , Shutterstock, Footage, Photographic studio, iStock, Uniform","Army Soldier Deep In Thought Stock Photo - iStock, Distraught Army Soldier Looking Down Stock Photo - iStock, Young Army Soldier Crying Closeup With Copyspace Stock Photo, Distraught Army Soldier Looking Down Stock Photo 1331332103, African Military Male With Neutral Expression Stock Photo - iStock, Broken Military Helmet photos - Shutterstock, Latin Uniform School photos - Shutterstock, 146512 Military Portrait Images, Stock Photos, and Vectors, Army Soldier Back Home with Cute Gifts for Loved Ones Stock Photo, Army Male Soldier and Confusion Stock Photo - Dreamstime.com, Army Soldier Wearing Sunglasses with Peace Sign Stock Photo, Army Soldier Recovering after Work Accident Stock Photo, Close Portrait Handsome Young Asian Army Soldier Front Wall, Sad Soldier Images – Browse 16018 Stock Photos, Vectors, and Video, Military mixed race Stock Photos - Depositphotos"
A photo of two children watching Ukrainian soldiers roll past atop two tanks in 2016.,images/false_273.jpg,out-of-context,ukraine checkpoint,"Volodymyr Zelenskyy, Russian invasion of Ukraine, Russia, Russo-Ukrainian War, , , Kharkiv Oblast, United States, ","Dangerous Games: Children In Ukraine Play At War - RFE/RL, 148 day of war Maksym and Andrii 11, years old boys ... - Instagram, The Children of Ukraine's War - The New York Times, News Analysis: Entering a sixth month of war, Ukraine faces thorny ..., Russia expands goals in Ukraine as war enters fifth month, US pledges $1 billion for more rockets and other arms for Ukraine, Editorial: In the long haul against Putin, the West must not succumb ..., Russia expands goals in Ukraine as war enters fifth month, President Zelenskyy visits port as Ukraine prepares to ship out grain ..., Russia invades Ukraine - ABC News - The Walt Disney Company, Ukraine war must end to prevent nuclear 'abyss': Lukashenko, Ukraine's first lady asks US for more weapons against Russia's ..., Evgeniy Maloletka (@evgenymaloletka) • Instagram photos and videos, Ukrainian children share their harrowing accounts of war in new ITV ..., Berdiansk Territorial Community - Cities 4 Cities | United 4 Ukraine"
